,Aspect,Document,Sentiment,Dataset
1096,RESTAURANT#MISCELLANEOUS,It's definately not a place to go if you want to impress someone.,negative,ABSA16_Restaurants_Train_SB1_v2.csv
1113,RESTAURANT#MISCELLANEOUS,How do you rate home?,positive,ABSA16_Restaurants_Train_SB1_v2.csv
1135,RESTAURANT#MISCELLANEOUS,"It was the first place we ate on our first trip to New York, and it will be the last place we stop as we head out of town on our next trip to New York.",positive,ABSA16_Restaurants_Train_SB1_v2.csv
1162,RESTAURANT#MISCELLANEOUS,This is the perfect date spot for Williamsburg couples.,positive,ABSA16_Restaurants_Train_SB1_v2.csv
1166,RESTAURANT#MISCELLANEOUS,"If only they delivered, they'd make a mint!",neutral,ABSA16_Restaurants_Train_SB1_v2.csv
1191,RESTAURANT#MISCELLANEOUS,Good luck getting a table.,neutral,ABSA16_Restaurants_Train_SB1_v2.csv
1233,RESTAURANT#MISCELLANEOUS,A great place to meet up for some food and drinks...,positive,ABSA16_Restaurants_Train_SB1_v2.csv
1296,RESTAURANT#MISCELLANEOUS,"I found it on a cold night, the perfect spot to warm up.",positive,ABSA16_Restaurants_Train_SB1_v2.csv
1365,RESTAURANT#MISCELLANEOUS,"Place is open till late, no dress code.",positive,ABSA16_Restaurants_Train_SB1_v2.csv
1371,RESTAURANT#MISCELLANEOUS,"The space is limited so be prepared to wait up to 45 minutes - 1 hour, but be richly rewarded when you savor the delicious indo-chinese food.",negative,ABSA16_Restaurants_Train_SB1_v2.csv
1392,RESTAURANT#MISCELLANEOUS,The only downside... they only take cash which is OK if you know about it ahead of time.,negative,ABSA16_Restaurants_Train_SB1_v2.csv
1436,RESTAURANT#MISCELLANEOUS,I noticed alot of indian people eatting there which is a great sign for an indian place!,positive,ABSA16_Restaurants_Train_SB1_v2.csv
1441,RESTAURANT#MISCELLANEOUS,Nice for one time special occasion.,positive,ABSA16_Restaurants_Train_SB1_v2.csv
1449,RESTAURANT#MISCELLANEOUS,Remind me of home.,positive,ABSA16_Restaurants_Train_SB1_v2.csv
1456,RESTAURANT#MISCELLANEOUS,Pacifico is a great place to casually hang out.,positive,ABSA16_Restaurants_Train_SB1_v2.csv
1480,RESTAURANT#MISCELLANEOUS,Got a date? Go here!,positive,ABSA16_Restaurants_Train_SB1_v2.csv
1481,RESTAURANT#MISCELLANEOUS,Every time I have a special occasion with my boyfriend I have a hard time going anywhere else.,positive,ABSA16_Restaurants_Train_SB1_v2.csv
1487,RESTAURANT#MISCELLANEOUS,Once you try it for a special occasion beware.. you can't stop!,positive,ABSA16_Restaurants_Train_SB1_v2.csv
1488,RESTAURANT#MISCELLANEOUS,"You'll be ther for every anniversary, birthday, valentines day...",positive,ABSA16_Restaurants_Train_SB1_v2.csv
1489,RESTAURANT#MISCELLANEOUS,For a Fabulous Wedding!,positive,ABSA16_Restaurants_Train_SB1_v2.csv
1490,RESTAURANT#MISCELLANEOUS,My daughter's wedding reception at Water's Edge received the highest compliments from our guests.,positive,ABSA16_Restaurants_Train_SB1_v2.csv
1556,RESTAURANT#MISCELLANEOUS,"For a restaurant with such a good reputation and that is usually so packed, there was no reason for such a lack of intelligent customer service.",positive,ABSA16_Restaurants_Train_SB1_v2.csv
1565,RESTAURANT#MISCELLANEOUS,It's a great place to order from or sit-in.,positive,ABSA16_Restaurants_Train_SB1_v2.csv
1572,RESTAURANT#MISCELLANEOUS,"Yamato is an excellent place to go if youre not into sashimi, or if you have friends who doesnt like sushi much.",positive,ABSA16_Restaurants_Train_SB1_v2.csv
1595,RESTAURANT#MISCELLANEOUS,This place survives on reputation alone.,negative,ABSA16_Restaurants_Train_SB1_v2.csv
1621,RESTAURANT#MISCELLANEOUS,"Be prepared to wait, because the place is pretty tiny.",negative,ABSA16_Restaurants_Train_SB1_v2.csv
1622,RESTAURANT#MISCELLANEOUS,"Also, they do not take credit card so come with cash!",neutral,ABSA16_Restaurants_Train_SB1_v2.csv
1652,RESTAURANT#MISCELLANEOUS,Surprised that a place of this caliber would advertise it as Kobe.,negative,ABSA16_Restaurants_Train_SB1_v2.csv
1662,RESTAURANT#MISCELLANEOUS,"The Four Seasons has history and it is a sort of landmark of New York City restaurants, but trust me, they will charge you through the nose just so that you can say ""I've been to the four seasons restaurant"".",neutral,ABSA16_Restaurants_Train_SB1_v2.csv
1703,RESTAURANT#MISCELLANEOUS,Don't go with a larger group than 4!,negative,ABSA16_Restaurants_Train_SB1_v2.csv
1762,RESTAURANT#MISCELLANEOUS,I completely recommend Casa La Femme for any special occasion and to REALLY impress your date.,positive,ABSA16_Restaurants_Train_SB1_v2.csv
1784,RESTAURANT#MISCELLANEOUS,We've tried before but it always packed and doesn't take reservations.,neutral,ABSA16_Restaurants_Train_SB1_v2.csv
1901,RESTAURANT#MISCELLANEOUS,The reason there are 4 different results on citysearch for the same place is because they keep trying to start a new thread so they can stock it with positive reviews.,negative,ABSA16_Restaurants_Train_SB1_v2.csv
1921,RESTAURANT#MISCELLANEOUS,"As BFC doesn't take reservations you almost always have to wait by the bar - and be abused by the front of house staff until you are seated, which can be over an hour later!",negative,ABSA16_Restaurants_Train_SB1_v2.csv
1986,RESTAURANT#MISCELLANEOUS,We didn't look like the other patrons in there so unfortunately I think that may have been part of the problem.,negative,ABSA16_Restaurants_Train_SB1_v2.csv
31,COMPANY#GENERAL,"And, if you are going to deal with HP be careful.",negative,ABSA16_Laptops_Train_SB1_v2.csv
32,COMPANY#GENERAL,"In my house, HP is a nasty word.",negative,ABSA16_Laptops_Train_SB1_v2.csv
92,COMPANY#GENERAL,I do not recommend this company or their products!!!!,negative,ABSA16_Laptops_Train_SB1_v2.csv
104,COMPANY#GENERAL,I am loyal to Apple.,positive,ABSA16_Laptops_Train_SB1_v2.csv
148,COMPANY#GENERAL,So if anyones looking to buy a computer or laptop you should stay far far away from any that have the name TOSHIBA on it...,negative,ABSA16_Laptops_Train_SB1_v2.csv
213,COMPANY#GENERAL,And Toshiba is a quality supplier.,positive,ABSA16_Laptops_Train_SB1_v2.csv
260,COMPANY#GENERAL,"Toshiba is a great brand, even though I haven't had it for a long time, I am very happy with it!",positive,ABSA16_Laptops_Train_SB1_v2.csv
275,COMPANY#GENERAL,Once again apple stands alone at the top of the charts.,positive,ABSA16_Laptops_Train_SB1_v2.csv
371,COMPANY#GENERAL,I love the Apple products.,positive,ABSA16_Laptops_Train_SB1_v2.csv
385,COMPANY#GENERAL,I'll rather be out of date then spend more money on toshiba.,negative,ABSA16_Laptops_Train_SB1_v2.csv
386,COMPANY#GENERAL,Remember to do your research first before consider buying a toshiba product.,negative,ABSA16_Laptops_Train_SB1_v2.csv
418,COMPANY#GENERAL,I will never purchase a HP again ever.,negative,ABSA16_Laptops_Train_SB1_v2.csv
419,COMPANY#GENERAL,"Let's just get this out of the way, I love Apple!",positive,ABSA16_Laptops_Train_SB1_v2.csv
466,COMPANY#GENERAL,Summary: Dont buy HP.,negative,ABSA16_Laptops_Train_SB1_v2.csv
467,COMPANY#GENERAL,"If you buy, pray you dont have major prolems.",negative,ABSA16_Laptops_Train_SB1_v2.csv
469,COMPANY#GENERAL,I thought we were paying for quality in our decision to buy an Apple product.,negative,ABSA16_Laptops_Train_SB1_v2.csv
628,COMPANY#GENERAL,I will never buy another computer from Dell ever again do to how awful it worked and how I was treated by the company.,negative,ABSA16_Laptops_Train_SB1_v2.csv
645,COMPANY#GENERAL,NOW AM VERY APREHENSIVE ABOUT TOSHIBA LAPTOPS.,negative,ABSA16_Laptops_Train_SB1_v2.csv
683,COMPANY#GENERAL,"tosiba has a good reputation, my llast computer was an acer.",positive,ABSA16_Laptops_Train_SB1_v2.csv
745,COMPANY#GENERAL,I'm all for saving money but Dell needs to step it up.,negative,ABSA16_Laptops_Train_SB1_v2.csv
802,COMPANY#GENERAL,My friends or children use that when they need to borrow the Net =) When I out grow this Meaning when its old and my oldest child is ready for one she will get this one ANd I will be buying only TOSHIBA!,positive,ABSA16_Laptops_Train_SB1_v2.csv
874,COMPANY#GENERAL,Apple continues to shine and provide a much more enjoyable computer experience!,positive,ABSA16_Laptops_Train_SB1_v2.csv
940,COMPANY#GENERAL,I just hope the reputation that Toshiba has is true and I won't have to worry about a crash.,neutral,ABSA16_Laptops_Train_SB1_v2.csv
1050,COMPANY#GENERAL,"But if you can't make your product last more than a year, you will not get my business again.",negative,ABSA16_Laptops_Train_SB1_v2.csv
1146,COMPANY#GENERAL,My next laptop will also be a Mac!,positive,ABSA16_Laptops_Train_SB1_v2.csv
1156,COMPANY#GENERAL,I will only buy apple laptops from now on.,positive,ABSA16_Laptops_Train_SB1_v2.csv
1192,COMPANY#GENERAL,That was my first Apple product and since then I have been incredibly happy with every product of theirs I have bought.,positive,ABSA16_Laptops_Train_SB1_v2.csv
1230,COMPANY#GENERAL,I will never buy anything from HP again!,negative,ABSA16_Laptops_Train_SB1_v2.csv
1259,COMPANY#GENERAL,"this company truely does make horrible products and doesnt seem to because they are certain things like this ""never"" happen...",negative,ABSA16_Laptops_Train_SB1_v2.csv
1319,COMPANY#GENERAL,Will probably never buy a HP again.,negative,ABSA16_Laptops_Train_SB1_v2.csv
1355,COMPANY#GENERAL,So buyer beware when buying Toshiba,negative,ABSA16_Laptops_Train_SB1_v2.csv
1365,COMPANY#GENERAL,"For my burn thigh which has put a permanent mark on my skin (it happened 7 months ago) they offered me an ITouch 8Gig (you know it is a bit insulating when a company this rich, offer a loyal customer like me, a bottom of their product line as a gift for events like this).",negative,ABSA16_Laptops_Train_SB1_v2.csv
1366,COMPANY#GENERAL,"Steve Jobs, probably needs help and donations, and cannot afford a reasonable offers for people that truly are trying to support his baby.",negative,ABSA16_Laptops_Train_SB1_v2.csv
1367,COMPANY#GENERAL,"The lesson learned here is: It does not pay to by this loyal to any brand, since all of them are there to simply  to make as much money as possible, as fast as they can, and in this day and age, the customer no longer is right all the times.",negative,ABSA16_Laptops_Train_SB1_v2.csv
1417,COMPANY#GENERAL,If you are looking for a netbook pc DO NOT BUY FROM ASUS!!!,negative,ABSA16_Laptops_Train_SB1_v2.csv
1514,COMPANY#GENERAL,"I don't like this company nor the toshiba brand, and I'll never  buy another one because I've put more into it then it is worth.",negative,ABSA16_Laptops_Train_SB1_v2.csv
1515,COMPANY#GENERAL,I would  rather spend my money on a computer that costs more then a Toshiba that  isn't good at all.,negative,ABSA16_Laptops_Train_SB1_v2.csv
1524,COMPANY#GENERAL,i cant believe HP put this out.,negative,ABSA16_Laptops_Train_SB1_v2.csv
1532,COMPANY#GENERAL,"I love HP,, it's the only computer/printer we will buy.",positive,ABSA16_Laptops_Train_SB1_v2.csv
1618,COMPANY#GENERAL,You will regret it if you buy any dell.,negative,ABSA16_Laptops_Train_SB1_v2.csv
1619,COMPANY#GENERAL,Dell sucks,negative,ABSA16_Laptops_Train_SB1_v2.csv
1631,COMPANY#GENERAL,In short I would never buy a Compaq again.,negative,ABSA16_Laptops_Train_SB1_v2.csv
1656,COMPANY#GENERAL,"Sorry Toshiba, but 1st impressions do count for something.",negative,ABSA16_Laptops_Train_SB1_v2.csv
1726,COMPANY#GENERAL,Guess I'll stay away from HP.,negative,ABSA16_Laptops_Train_SB1_v2.csv
1916,COMPANY#GENERAL,Avoid Acer.,negative,ABSA16_Laptops_Train_SB1_v2.csv
2171,COMPANY#GENERAL,"Seriously, save yourself the hassle and purchase from a different company.",negative,ABSA16_Laptops_Train_SB1_v2.csv
2176,COMPANY#GENERAL,I wonder if thats just Apples way of saying its time to get the newest and greatest laptop 3-4 years from now lol.,neutral,ABSA16_Laptops_Train_SB1_v2.csv
2201,COMPANY#GENERAL,I will be considering Lenovo for all future laptop purchases.,positive,ABSA16_Laptops_Train_SB1_v2.csv
2270,COMPANY#GENERAL,I've always sworn by dell.,positive,ABSA16_Laptops_Train_SB1_v2.csv
2329,COMPANY#GENERAL,Dell claims they test each key with thousands of mechanical key strokes.,negative,ABSA16_Laptops_Train_SB1_v2.csv
2339,COMPANY#GENERAL,No Lenovo for me.,negative,ABSA16_Laptops_Train_SB1_v2.csv
4,COMPANY#GENERAL,Glad I did so far.,,EN_LAPT_SB1_TEST_.B.csv
34,COMPANY#GENERAL,"I tried not to jump on the Apple bandwagon, but... you're just living in denial if you don't.",,EN_LAPT_SB1_TEST_.B.csv
36,COMPANY#GENERAL,Happy buying!,,EN_LAPT_SB1_TEST_.B.csv
47,COMPANY#GENERAL,etc. but the company and seller lied to you and try to make an extra buck!,,EN_LAPT_SB1_TEST_.B.csv
58,COMPANY#GENERAL,Thank you asus.(they don't deserve to be capitalized),,EN_LAPT_SB1_TEST_.B.csv
130,COMPANY#GENERAL,"To a prospective buyer,  08/10/2012  Once you go Mac, you'll never go back.",,EN_LAPT_SB1_TEST_.B.csv
280,COMPANY#GENERAL,"Here is my take on all of this, the business model Apple pushes right now is to get some cheap junk from China, hire a bunch of cheerleaders straight out of high school, call them geniuses, and bully everybody who complains about their product.",,EN_LAPT_SB1_TEST_.B.csv
281,COMPANY#GENERAL,"Steve Jobs is dead, so is Apple.",,EN_LAPT_SB1_TEST_.B.csv
282,COMPANY#GENERAL,No more Apple devices in my household.,,EN_LAPT_SB1_TEST_.B.csv
289,COMPANY#GENERAL,That's the only issue I've ever had since working on Macs in 1995.,,EN_LAPT_SB1_TEST_.B.csv
290,COMPANY#GENERAL,That's a pretty impressive track record don't you think?,,EN_LAPT_SB1_TEST_.B.csv
381,COMPANY#GENERAL,But Sony doesn't seem to have addressed it.,,EN_LAPT_SB1_TEST_.B.csv
506,COMPANY#GENERAL,"But, hey, it's an Apple.",,EN_LAPT_SB1_TEST_.B.csv
507,COMPANY#GENERAL,I wouldn't expect anything less!,,EN_LAPT_SB1_TEST_.B.csv
511,COMPANY#GENERAL,this company just wants customers' money in their pocket.,,EN_LAPT_SB1_TEST_.B.csv
512,COMPANY#GENERAL,they dont care how you feel when they charge you hundreds of hard earned dollars.,,EN_LAPT_SB1_TEST_.B.csv
513,COMPANY#GENERAL,I wish this company to go bust.,,EN_LAPT_SB1_TEST_.B.csv
514,COMPANY#GENERAL,I will never ever buy any apple product in my life.,,EN_LAPT_SB1_TEST_.B.csv
551,COMPANY#GENERAL,They really know what they are doing.,,EN_LAPT_SB1_TEST_.B.csv
566,COMPANY#GENERAL,Not impressed with Macintosh products.,,EN_LAPT_SB1_TEST_.B.csv
567,COMPANY#GENERAL,In fact I am completely frustrated.,,EN_LAPT_SB1_TEST_.B.csv
697,COMPANY#GENERAL,But Apple does not pretend it has any of these.,,EN_LAPT_SB1_TEST_.B.csv
720,COMPANY#GENERAL,"So, I'm cooled on Mac buys.",,EN_LAPT_SB1_TEST_.B.csv
773,COMPANY#GENERAL,Then there was a power cord recall....HP never notified us.....and we did register......never again.,,EN_LAPT_SB1_TEST_.B.csv
2,BATTERY#OPERATION_PERFORMANCE,10 plus hours of battery...,positive,ABSA16_Laptops_Train_SB1_v2.csv
49,BATTERY#OPERATION_PERFORMANCE,The battery doesn't last long but I'm sure an upgrade battery would solve that problem.,neutral,ABSA16_Laptops_Train_SB1_v2.csv
50,BATTERY#OPERATION_PERFORMANCE,I don't use my laptop in a way though that needs a long battery life so it's perfect for me.,positive,ABSA16_Laptops_Train_SB1_v2.csv
115,BATTERY#OPERATION_PERFORMANCE,"Suffice it to say, my MacBook Pro keeps me going with its long battery life and blazing speed.",positive,ABSA16_Laptops_Train_SB1_v2.csv
158,BATTERY#OPERATION_PERFORMANCE,Has a 5-6 hour battery life.,positive,ABSA16_Laptops_Train_SB1_v2.csv
180,BATTERY#OPERATION_PERFORMANCE,The battery is really long.,positive,ABSA16_Laptops_Train_SB1_v2.csv
218,BATTERY#OPERATION_PERFORMANCE,great battery life.,positive,ABSA16_Laptops_Train_SB1_v2.csv
246,BATTERY#OPERATION_PERFORMANCE,I BOUGHT THIS LAP TOP AND THE CHARGE TIME DOSEN'T LAST AS LONG AS THEY SAY IT WILL MORE LIKE 2 HOURS,negative,ABSA16_Laptops_Train_SB1_v2.csv
285,BATTERY#OPERATION_PERFORMANCE,"The battery life seems to be very good, and have had no issues with it.",positive,ABSA16_Laptops_Train_SB1_v2.csv
440,BATTERY#OPERATION_PERFORMANCE,Battery is lasting about 6 hours as I am surfing the web on Sundays while checking football scores and watching funny Youtube videos.,positive,ABSA16_Laptops_Train_SB1_v2.csv
452,BATTERY#OPERATION_PERFORMANCE,Battery life needs more life.,negative,ABSA16_Laptops_Train_SB1_v2.csv
456,BATTERY#OPERATION_PERFORMANCE,The only downfall is the battery only last 1.5-2.0 hrs when not plugged in.,negative,ABSA16_Laptops_Train_SB1_v2.csv
457,BATTERY#OPERATION_PERFORMANCE,I would like at least a 4 hr. battery life.,negative,ABSA16_Laptops_Train_SB1_v2.csv
487,BATTERY#OPERATION_PERFORMANCE,"I bought it for my mom and she reports that the battery life lasts all day for her, it's very lightweight, and the response for the computing she's doing (Internet focused activity: mail, research, etc.) is excellent;",positive,ABSA16_Laptops_Train_SB1_v2.csv
492,BATTERY#OPERATION_PERFORMANCE,"still testing the battery life as i thought it would be better, but am very happy with the upgrade.",neutral,ABSA16_Laptops_Train_SB1_v2.csv
496,BATTERY#OPERATION_PERFORMANCE,I've been impressed with the battery life and the performance for such a small amount of memory.,positive,ABSA16_Laptops_Train_SB1_v2.csv
501,BATTERY#OPERATION_PERFORMANCE,"Needs longer lasting battery, More than 1 to 2 Hrs.",negative,ABSA16_Laptops_Train_SB1_v2.csv
543,BATTERY#OPERATION_PERFORMANCE,"The battery life has not decreased since I bought it, so i'm thrilled with that.",positive,ABSA16_Laptops_Train_SB1_v2.csv
570,BATTERY#OPERATION_PERFORMANCE,"The battery life is amazing, the versitility is outstanding.",positive,ABSA16_Laptops_Train_SB1_v2.csv
577,BATTERY#OPERATION_PERFORMANCE,I couldn't believe how long the battery lasted on a single charge.,positive,ABSA16_Laptops_Train_SB1_v2.csv
665,BATTERY#OPERATION_PERFORMANCE,Very long-life battery (up to 10-11 hours depending on how you configure power level settings).,positive,ABSA16_Laptops_Train_SB1_v2.csv
776,BATTERY#OPERATION_PERFORMANCE,The statement of 7 hour battery life is not just mere exaggeration -- it's a lie.,negative,ABSA16_Laptops_Train_SB1_v2.csv
777,BATTERY#OPERATION_PERFORMANCE,I challenge anyone to show proof that through anywhere near normal use can get more than 2.5 hrs out of it.,negative,ABSA16_Laptops_Train_SB1_v2.csv
778,BATTERY#OPERATION_PERFORMANCE,The first full charge of this battery got me only about 2 full hours.,negative,ABSA16_Laptops_Train_SB1_v2.csv
779,BATTERY#OPERATION_PERFORMANCE,Enabling the battery timer is useless.,negative,ABSA16_Laptops_Train_SB1_v2.csv
780,BATTERY#OPERATION_PERFORMANCE,"The ""Time remaining"" goes from 4 hours plus to less than 2 hours over the span of about 10 minutes.",negative,ABSA16_Laptops_Train_SB1_v2.csv
782,BATTERY#OPERATION_PERFORMANCE,It's so bad that I'm thinking I only got half a battery or something.,negative,ABSA16_Laptops_Train_SB1_v2.csv
783,BATTERY#OPERATION_PERFORMANCE,I know what 7 hrs of battery looks like.,negative,ABSA16_Laptops_Train_SB1_v2.csv
786,BATTERY#OPERATION_PERFORMANCE,"If you buy this - don't go into it expecting 7 hrs of battery life, and you'll be perfectly satisfied.",negative,ABSA16_Laptops_Train_SB1_v2.csv
949,BATTERY#OPERATION_PERFORMANCE,Another issue I have with it is the battery.,negative,ABSA16_Laptops_Train_SB1_v2.csv
950,BATTERY#OPERATION_PERFORMANCE,Maybe three or four months ago it started blinking all of the sudden.,negative,ABSA16_Laptops_Train_SB1_v2.csv
951,BATTERY#OPERATION_PERFORMANCE,"There is a small red circle next to it with a x in the middle, and when I click on it it says: "" Consider replacing your battery"" and it does not hold full charge.",negative,ABSA16_Laptops_Train_SB1_v2.csv
967,BATTERY#OPERATION_PERFORMANCE,The only bad thing about it is they give you the worst batteries possible.,negative,ABSA16_Laptops_Train_SB1_v2.csv
968,BATTERY#OPERATION_PERFORMANCE,They only stay charged a little over an hour.,negative,ABSA16_Laptops_Train_SB1_v2.csv
969,BATTERY#OPERATION_PERFORMANCE,"Laptops are usually used on the go, so why not give you a better battery?",negative,ABSA16_Laptops_Train_SB1_v2.csv
986,BATTERY#OPERATION_PERFORMANCE,The only thing is that the battery won't last more than 1/2 an hour.,negative,ABSA16_Laptops_Train_SB1_v2.csv
987,BATTERY#OPERATION_PERFORMANCE,It discharges too quickly.,negative,ABSA16_Laptops_Train_SB1_v2.csv
1159,BATTERY#OPERATION_PERFORMANCE,Battery life could be better but overall for the price and Toshiba's reputation for laptops it's great!,neutral,ABSA16_Laptops_Train_SB1_v2.csv
1162,BATTERY#OPERATION_PERFORMANCE,"The system constantly overheats, the battery life is too short, the case is coming apart, and my core applications that I use every day in my work as a graphic artist run poorly.",negative,ABSA16_Laptops_Train_SB1_v2.csv
1297,BATTERY#OPERATION_PERFORMANCE,The battery life is probably an hour at best.,negative,ABSA16_Laptops_Train_SB1_v2.csv
1311,BATTERY#OPERATION_PERFORMANCE,"Also, the battery does not last very long at all.",negative,ABSA16_Laptops_Train_SB1_v2.csv
1431,BATTERY#OPERATION_PERFORMANCE,"It has a 10 hour battery life when you're doing web browsing and word editing, making it perfect for the classroom or office, and in terms of gaming and movie playing it'll have a battery life of just over 5 hours.",positive,ABSA16_Laptops_Train_SB1_v2.csv
1472,BATTERY#OPERATION_PERFORMANCE,very convenient when you travel and the battery life is excellent...,positive,ABSA16_Laptops_Train_SB1_v2.csv
1473,BATTERY#OPERATION_PERFORMANCE,10 hours of battery life is really something else....,positive,ABSA16_Laptops_Train_SB1_v2.csv
1540,BATTERY#OPERATION_PERFORMANCE,"They gave me a hard time yet again, but their was a malfunction in the battery itself, it didn't die.",negative,ABSA16_Laptops_Train_SB1_v2.csv
1697,BATTERY#OPERATION_PERFORMANCE,"Great battery, speed, display.",positive,ABSA16_Laptops_Train_SB1_v2.csv
1710,BATTERY#OPERATION_PERFORMANCE,"The battery never held a charge longer than one hour and within two months, stopped holding a charge for more than ten minutes.",negative,ABSA16_Laptops_Train_SB1_v2.csv
1779,BATTERY#OPERATION_PERFORMANCE,Battery could be better but it has robust processor and plenty of RAM so that is a trade off I suppose.,negative,ABSA16_Laptops_Train_SB1_v2.csv
1898,BATTERY#OPERATION_PERFORMANCE,The battery will get you from LA to NY no problem.,positive,ABSA16_Laptops_Train_SB1_v2.csv
1936,BATTERY#OPERATION_PERFORMANCE,"The battery life is good, even with using high profile software like Sibelius 7 for a good half of the day.",positive,ABSA16_Laptops_Train_SB1_v2.csv
1966,BATTERY#OPERATION_PERFORMANCE,Battery life is astonishing given the processing power and high resolution display.,positive,ABSA16_Laptops_Train_SB1_v2.csv
1967,BATTERY#OPERATION_PERFORMANCE,I can easily get 10 hours out of a full charge.,positive,ABSA16_Laptops_Train_SB1_v2.csv
2002,BATTERY#OPERATION_PERFORMANCE,The battery life is a joke and it's causing other problems.,negative,ABSA16_Laptops_Train_SB1_v2.csv
2050,BATTERY#OPERATION_PERFORMANCE,Battery doesn't last long web browsing (2.5 hours maybe).,negative,ABSA16_Laptops_Train_SB1_v2.csv
2100,BATTERY#OPERATION_PERFORMANCE,The battery is pretty soild.,positive,ABSA16_Laptops_Train_SB1_v2.csv
2101,BATTERY#OPERATION_PERFORMANCE,It lasts up to 5-6 hours with normal use.,positive,ABSA16_Laptops_Train_SB1_v2.csv
2157,BATTERY#OPERATION_PERFORMANCE,The battery seems adequate for most uses ~ 4.5 hour use/charge.,positive,ABSA16_Laptops_Train_SB1_v2.csv
2166,BATTERY#OPERATION_PERFORMANCE,Good battery life as well.,positive,ABSA16_Laptops_Train_SB1_v2.csv
2198,BATTERY#OPERATION_PERFORMANCE,"Battery life is above average, and it charges quickly.",positive,ABSA16_Laptops_Train_SB1_v2.csv
2342,BATTERY#OPERATION_PERFORMANCE,But now I am having battery problems.,negative,ABSA16_Laptops_Train_SB1_v2.csv
12,BATTERY#OPERATION_PERFORMANCE,Great battery life.,,EN_LAPT_SB1_TEST_.B.csv
61,BATTERY#OPERATION_PERFORMANCE,Good battery life.,,EN_LAPT_SB1_TEST_.B.csv
79,BATTERY#OPERATION_PERFORMANCE,Battery life is great - though it is new.,,EN_LAPT_SB1_TEST_.B.csv
106,BATTERY#OPERATION_PERFORMANCE,Even the battery life is like WOW!,,EN_LAPT_SB1_TEST_.B.csv
110,BATTERY#OPERATION_PERFORMANCE,"It contains a long battery life, incredible specs, and an overall enjoyable performance.",,EN_LAPT_SB1_TEST_.B.csv
304,BATTERY#OPERATION_PERFORMANCE,Battery Life- My battery life is really good with this laptop and I have had no problems with it thus far.,,EN_LAPT_SB1_TEST_.B.csv
305,BATTERY#OPERATION_PERFORMANCE,I can usually go about 10 hours before I get down to 10% battery life.,,EN_LAPT_SB1_TEST_.B.csv
578,BATTERY#OPERATION_PERFORMANCE,"The battery life has increased from the last version from 4 hours to 7 hours, making it easy for college students to study for extended periods of time without needing a charger.",,EN_LAPT_SB1_TEST_.B.csv
589,BATTERY#OPERATION_PERFORMANCE,o It has an extended battery life.,,EN_LAPT_SB1_TEST_.B.csv
596,BATTERY#OPERATION_PERFORMANCE,Battery doesn't hold up to what it said in the description but I got it refurb'd and I imagine they swapped out the battery to help cover the costs on the reduced price (Just a guess).,,EN_LAPT_SB1_TEST_.B.csv
621,BATTERY#OPERATION_PERFORMANCE,The batter lasts as long as claimed.,,EN_LAPT_SB1_TEST_.B.csv
622,BATTERY#OPERATION_PERFORMANCE,I get about 5 or so hours playing the sims.,,EN_LAPT_SB1_TEST_.B.csv
623,BATTERY#OPERATION_PERFORMANCE,"I haven't really officially tested it yet, but it's a long time.",,EN_LAPT_SB1_TEST_.B.csv
624,BATTERY#OPERATION_PERFORMANCE,"I hate plugging my laptop in because I don't want to leave it on too long and hurt the battery, but with this laptop I rarely have to charge it.",,EN_LAPT_SB1_TEST_.B.csv
58,FOOD#STYLE_OPTIONS,The rice to fish ration was also good--they didn't try to overpack the rice.,positive,ABSA16_Restaurants_Train_SB1_v2.csv
73,FOOD#STYLE_OPTIONS,"$6 and there is much tasty food, all of it fresh and continually refilled.",positive,ABSA16_Restaurants_Train_SB1_v2.csv
