,Aspect,Document,Sentiment,Dataset
1473,FOOD#QUALITY,"Great food, amazing service, this place is a class act.",positive,ABSA16_Restaurants_Train_SB1_v2.csv
1474,FOOD#QUALITY,The veal was incredible last night.,positive,ABSA16_Restaurants_Train_SB1_v2.csv
1475,FOOD#QUALITY,"Fresh, mind blowing flavors.",positive,ABSA16_Restaurants_Train_SB1_v2.csv
1479,FOOD#QUALITY,"Delicious, creative and fun.",positive,ABSA16_Restaurants_Train_SB1_v2.csv
1486,FOOD#QUALITY,I've enjoyed 99% of the dishes we've ordered with the only exceptions being the occasional too-authentic-for-me dish (I'm a daring eater but not THAT daring).,positive,ABSA16_Restaurants_Train_SB1_v2.csv
1501,FOOD#QUALITY,The stuff tilapia was horrid...tasted like cardboard.,negative,ABSA16_Restaurants_Train_SB1_v2.csv
1502,FOOD#QUALITY,"We thought the dessert would be better, Wrong!",negative,ABSA16_Restaurants_Train_SB1_v2.csv
1510,FOOD#QUALITY,"The bread we received was horrible - rock hard and cold - and the ""free"" appetizer of olives was disappointing.",negative,ABSA16_Restaurants_Train_SB1_v2.csv
1511,FOOD#QUALITY,"However, our main course was wonderful.",positive,ABSA16_Restaurants_Train_SB1_v2.csv
1512,FOOD#QUALITY,I had fish and my husband had the filet - both of which exceeded our expectations.,positive,ABSA16_Restaurants_Train_SB1_v2.csv
1513,FOOD#QUALITY,"The dessert (we had a pear torte) was good - but, once again, the staff was unable to provide appropriate drink suggestions.",positive,ABSA16_Restaurants_Train_SB1_v2.csv
1520,FOOD#QUALITY,The food was ok and fair nothing to go crazy.,neutral,ABSA16_Restaurants_Train_SB1_v2.csv
1526,FOOD#QUALITY,Subtle food and service,positive,ABSA16_Restaurants_Train_SB1_v2.csv
1534,FOOD#QUALITY,amazing fresh dogs but best of all endless toppings!!!,positive,ABSA16_Restaurants_Train_SB1_v2.csv
1542,FOOD#QUALITY,"Food took some time to prepare, all worth waiting for.",positive,ABSA16_Restaurants_Train_SB1_v2.csv
1546,FOOD#QUALITY,Maggot in the food!,negative,ABSA16_Restaurants_Train_SB1_v2.csv
1549,FOOD#QUALITY,"Nevertheless, I finished my plate, and that's when I found a maggot in mushroom sauce at the bottom.",negative,ABSA16_Restaurants_Train_SB1_v2.csv
1555,FOOD#QUALITY,"I have worked in restaurants and cook a lot, and there is no way a maggot should be able to get into well prepared food.",negative,ABSA16_Restaurants_Train_SB1_v2.csv
1558,FOOD#QUALITY,Unhygienic,negative,ABSA16_Restaurants_Train_SB1_v2.csv
1561,FOOD#QUALITY,I got hair in my food 2 times of then !,negative,ABSA16_Restaurants_Train_SB1_v2.csv
1563,FOOD#QUALITY,"The food is flavorful, plentiful and reasonably priced.",positive,ABSA16_Restaurants_Train_SB1_v2.csv
1568,FOOD#QUALITY,Sushi experience was unbelievable with my fiance.,positive,ABSA16_Restaurants_Train_SB1_v2.csv
1571,FOOD#QUALITY,Good creative rolls!,positive,ABSA16_Restaurants_Train_SB1_v2.csv
1573,FOOD#QUALITY,"They have great rolls, the triple color and norwegetan rolls, are awesome and filling.",positive,ABSA16_Restaurants_Train_SB1_v2.csv
1574,FOOD#QUALITY,"One special roll and one regular roll is enough to fill you up, but save room for dessert!",positive,ABSA16_Restaurants_Train_SB1_v2.csv
1575,FOOD#QUALITY,"They have a delicious banana chocolate dessert, as well as a great green tea tempura.",positive,ABSA16_Restaurants_Train_SB1_v2.csv
1576,FOOD#QUALITY,The appetizers are also delicious!,positive,ABSA16_Restaurants_Train_SB1_v2.csv
1577,FOOD#QUALITY,Amazing food.,positive,ABSA16_Restaurants_Train_SB1_v2.csv
1579,FOOD#QUALITY,Great food!,positive,ABSA16_Restaurants_Train_SB1_v2.csv
1580,FOOD#QUALITY,I've had my fair share of modern Japanese and this spot delivers.,positive,ABSA16_Restaurants_Train_SB1_v2.csv
1583,FOOD#QUALITY,Despite the confusing mirrors this will likely be my go-to for modern Japanese food for the foreseeable future.,positive,ABSA16_Restaurants_Train_SB1_v2.csv
1585,FOOD#QUALITY,"Indo Chinese food, pretty good...",positive,ABSA16_Restaurants_Train_SB1_v2.csv
1587,FOOD#QUALITY,"The chicken lollipop is my favorite, most of the dishes (I have to agree with a previous reviewer) are quite oily and very spicy, espeically the Chilli Chicken.",positive,ABSA16_Restaurants_Train_SB1_v2.csv
1588,FOOD#QUALITY,"My mom originally introduced me to this place, but even she (being Indian) feels the food can be somewhat over the top spicy and far too oily.",negative,ABSA16_Restaurants_Train_SB1_v2.csv
1590,FOOD#QUALITY,I was speechless by the horrible food.,negative,ABSA16_Restaurants_Train_SB1_v2.csv
1591,FOOD#QUALITY,"I attended a holiday dinner at the restaurant, and the food was majorly disappointing.",negative,ABSA16_Restaurants_Train_SB1_v2.csv
1599,FOOD#QUALITY,"for 7 years they have put out the most tasty, most delicious food and kept it that way...",positive,ABSA16_Restaurants_Train_SB1_v2.csv
1603,FOOD#QUALITY,"great food, great wine list, great service in a great neighborhood...",positive,ABSA16_Restaurants_Train_SB1_v2.csv
1604,FOOD#QUALITY,so delicious!!!!!!,positive,ABSA16_Restaurants_Train_SB1_v2.csv
1606,FOOD#QUALITY,Hands down the best pizza on the planet.,positive,ABSA16_Restaurants_Train_SB1_v2.csv
1608,FOOD#QUALITY,"In about 12 minutes, the thing is gone.",positive,ABSA16_Restaurants_Train_SB1_v2.csv
1610,FOOD#QUALITY,great hot dogs..,positive,ABSA16_Restaurants_Train_SB1_v2.csv
1611,FOOD#QUALITY,the hot dogs were juicy and tender inside and had plenty of crunch and snap on the outside.,positive,ABSA16_Restaurants_Train_SB1_v2.csv
1612,FOOD#QUALITY,great toppings definitely a place you need to check out for late night munchies or a mid day boost!,positive,ABSA16_Restaurants_Train_SB1_v2.csv
1613,FOOD#QUALITY,great taste,positive,ABSA16_Restaurants_Train_SB1_v2.csv
1614,FOOD#QUALITY,"Great, original taste.",positive,ABSA16_Restaurants_Train_SB1_v2.csv
1615,FOOD#QUALITY,"For me dishes a little oily, but overall dining experience good.",negative,ABSA16_Restaurants_Train_SB1_v2.csv
1618,FOOD#QUALITY,great food,positive,ABSA16_Restaurants_Train_SB1_v2.csv
1619,FOOD#QUALITY,This place has great indian chinese food.,positive,ABSA16_Restaurants_Train_SB1_v2.csv
1620,FOOD#QUALITY,The flavors are amazing and the value is phenomenal.,positive,ABSA16_Restaurants_Train_SB1_v2.csv
1624,FOOD#QUALITY,"Best Indian Chinese in the city, by far!",positive,ABSA16_Restaurants_Train_SB1_v2.csv
1636,FOOD#QUALITY,Everything on the menu is great.,positive,ABSA16_Restaurants_Train_SB1_v2.csv
1643,FOOD#QUALITY,"Look, the appetizers were really good.",positive,ABSA16_Restaurants_Train_SB1_v2.csv
1644,FOOD#QUALITY,The entree was also very good.,positive,ABSA16_Restaurants_Train_SB1_v2.csv
1651,FOOD#QUALITY,Which of course is not real Kobe but Wagyu beef.,negative,ABSA16_Restaurants_Train_SB1_v2.csv
1655,FOOD#QUALITY,Vanison was good but not amazing.,neutral,ABSA16_Restaurants_Train_SB1_v2.csv
1656,FOOD#QUALITY,Bison was quite excellent however.,positive,ABSA16_Restaurants_Train_SB1_v2.csv
1657,FOOD#QUALITY,Dessert: pure disaster.,negative,ABSA16_Restaurants_Train_SB1_v2.csv
1658,FOOD#QUALITY,Just not good at all.,negative,ABSA16_Restaurants_Train_SB1_v2.csv
1664,FOOD#QUALITY,"All in all, the food was great (except for the dessserts).",positive,ABSA16_Restaurants_Train_SB1_v2.csv
1666,FOOD#QUALITY,"If you are going for the food, it will not be worth it.",negative,ABSA16_Restaurants_Train_SB1_v2.csv
1692,FOOD#QUALITY,My chicken was inedible as there were so many fatty lumps which i had to keep spitting out into my napkin.,negative,ABSA16_Restaurants_Train_SB1_v2.csv
1693,FOOD#QUALITY,I would not expect this for a $55 dinner.,negative,ABSA16_Restaurants_Train_SB1_v2.csv
1698,FOOD#QUALITY,"By the time we left our wallets were empy and so were our stomachs AND we missed the show we were supposed to see following our dinner, which would have been acceptable if we got to enjoy the experience of good food and belly dancers!",negative,ABSA16_Restaurants_Train_SB1_v2.csv
1699,FOOD#QUALITY,If it seemed possible to do so while there I would have fought my bill since my dinner portion of my meal was inedible!,negative,ABSA16_Restaurants_Train_SB1_v2.csv
1711,FOOD#QUALITY,The appetizers we ordered were served quickly - an order of fried oysters and clams were delicious but a tiny portion (maybe 3 of each).,positive,ABSA16_Restaurants_Train_SB1_v2.csv
1720,FOOD#QUALITY,I had the Thai style Fried Sea Bass...which was very good.,positive,ABSA16_Restaurants_Train_SB1_v2.csv
1721,FOOD#QUALITY,"Everyone seemed generally happy with their food, except my brother who had the grilled Mahi Mahi, seemingly drenched in Grapfruit Juice!",positive,ABSA16_Restaurants_Train_SB1_v2.csv
1722,FOOD#QUALITY,I heard the lobster roll was excellent.,positive,ABSA16_Restaurants_Train_SB1_v2.csv
1724,FOOD#QUALITY,"All in all the food was good - a little on the expensive side, but fresh.",positive,ABSA16_Restaurants_Train_SB1_v2.csv
1727,FOOD#QUALITY,Great Indian food,positive,ABSA16_Restaurants_Train_SB1_v2.csv
1729,FOOD#QUALITY,"Food was amazing - I love Indian food and eat it quite regularly, but I can say this is one of the best I've had.",positive,ABSA16_Restaurants_Train_SB1_v2.csv
1734,FOOD#QUALITY,"But if you're prepared to spend some $ and remember to ask if something they offer is complimentary, then this is the place to go for Indian food",positive,ABSA16_Restaurants_Train_SB1_v2.csv
1745,FOOD#QUALITY,I have never been so disgusted by both food an service.,negative,ABSA16_Restaurants_Train_SB1_v2.csv
1748,FOOD#QUALITY,"However, once I received my predictably mediocre order of what Dokebi thinks passes as Korean fair, (sometimes you have to settle when it's your only option), I got through about half my kimchee before I found a piece of random lettuce accompanied by a far more disgusting, slimy, clearly bad piece of fish skin.",negative,ABSA16_Restaurants_Train_SB1_v2.csv
1750,FOOD#QUALITY,"My main concern was the sanity of the food that was being sent out to myself and others, but I would be lying is I said that as someone who has worked in restaurants since the age of fifteen I was expecting at least a minimal effort on the part of the restaurant to amend the situation.",negative,ABSA16_Restaurants_Train_SB1_v2.csv
1752,FOOD#QUALITY,Less than three minutes passed before I found myself doubled over the toilet.,negative,ABSA16_Restaurants_Train_SB1_v2.csv
1753,FOOD#QUALITY,"My girlfriend, being slightly more aggressive, and having been equally disgusted causing her to throw out the remainder of her barely eaten meal, called back only to be informed that I was probably wrong and that it was most likely an oyster, and that we were also blacklisted from their restaurant.",negative,ABSA16_Restaurants_Train_SB1_v2.csv
1757,FOOD#QUALITY,Eat at your own risk.,negative,ABSA16_Restaurants_Train_SB1_v2.csv
1760,FOOD#QUALITY,I book a gorgeous white organza tent which included a four course prix fix menu which we enjoyed a lot.,positive,ABSA16_Restaurants_Train_SB1_v2.csv
1767,FOOD#QUALITY,"The bibimbap was average, but the stone bowl wasn't even close to sizzling.",neutral,ABSA16_Restaurants_Train_SB1_v2.csv
1769,FOOD#QUALITY,The nakgi-bokum was horrible.,negative,ABSA16_Restaurants_Train_SB1_v2.csv
1770,FOOD#QUALITY,Easily the worst stir-fried squid I've ever tasted.,negative,ABSA16_Restaurants_Train_SB1_v2.csv
1771,FOOD#QUALITY,The sauce tasted more like Chinese fast food than decent Korean.,negative,ABSA16_Restaurants_Train_SB1_v2.csv
1772,FOOD#QUALITY,"The side dishes were passable, and I did get a refill upon request.",neutral,ABSA16_Restaurants_Train_SB1_v2.csv
1778,FOOD#QUALITY,My wife had barely touched that mess of a dish.,negative,ABSA16_Restaurants_Train_SB1_v2.csv
1786,FOOD#QUALITY,The wife had the risotto which was amazing.,positive,ABSA16_Restaurants_Train_SB1_v2.csv
1788,FOOD#QUALITY,The farro salad and the mashed yukon potatoes were also extremely tasty.,positive,ABSA16_Restaurants_Train_SB1_v2.csv
1791,FOOD#QUALITY,A quintessential slice of NYC pizza.,neutral,ABSA16_Restaurants_Train_SB1_v2.csv
1792,FOOD#QUALITY,"The crust has a great bite and a good chew, the sauce is light with a nice acidity to it, the salt from the cheese is great, really heightens the flavor of all the other components.",positive,ABSA16_Restaurants_Train_SB1_v2.csv
1793,FOOD#QUALITY,"Personally I like the margherita pizza better, but they are all good.",positive,ABSA16_Restaurants_Train_SB1_v2.csv
1801,FOOD#QUALITY,We started off with a delightful sashimi amuse bouche.,positive,ABSA16_Restaurants_Train_SB1_v2.csv
1803,FOOD#QUALITY,"I picked the Grilled Black Cod as my entree, which I absolutely devoured while someone commented that the Grilled Salmon dish was better.",positive,ABSA16_Restaurants_Train_SB1_v2.csv
1806,FOOD#QUALITY,"For desserts, we tried the frozen black sesame mousse (interesting but not extraordinary) and matcha (powdered green tea) and blueberry cheesecake, which was phenomenal.",neutral,ABSA16_Restaurants_Train_SB1_v2.csv
1816,FOOD#QUALITY,Great Shabu Shabu,positive,ABSA16_Restaurants_Train_SB1_v2.csv
1820,FOOD#QUALITY,I tried a couple other dishes but wasn't too impressed.,neutral,ABSA16_Restaurants_Train_SB1_v2.csv
1821,FOOD#QUALITY,"But for the Shabu Shabu, you won't find much better in NY.",positive,ABSA16_Restaurants_Train_SB1_v2.csv
1823,FOOD#QUALITY,"The meat is fresh, the sauces are great, you get kimchi and a salad free with your meal and service is good too.",positive,ABSA16_Restaurants_Train_SB1_v2.csv
1824,FOOD#QUALITY,Dokebi gives Williamsburg the right one-two punch of classic Korean food and fusion twists like pork belly tacos.,positive,ABSA16_Restaurants_Train_SB1_v2.csv
1825,FOOD#QUALITY,"The hot dogs are good, yes, but the reason to get over here is the fantastic pork croquette sandwich, perfect on its supermarket squishy bun.",positive,ABSA16_Restaurants_Train_SB1_v2.csv
1828,FOOD#QUALITY,The food tasted very good.,positive,ABSA16_Restaurants_Train_SB1_v2.csv
1829,FOOD#QUALITY,The family seafood entree was very good.,positive,ABSA16_Restaurants_Train_SB1_v2.csv
1830,FOOD#QUALITY,The main entree was also very good.,positive,ABSA16_Restaurants_Train_SB1_v2.csv
1832,FOOD#QUALITY,"Price is high but the food is good, so I would come back again.",positive,ABSA16_Restaurants_Train_SB1_v2.csv
1838,FOOD#QUALITY,"The food they serve is not comforting, not appetizing and uncooked.",negative,ABSA16_Restaurants_Train_SB1_v2.csv
1840,FOOD#QUALITY,Good Food,positive,ABSA16_Restaurants_Train_SB1_v2.csv
1842,FOOD#QUALITY,"The food was great and tasty, but the sitting space was too small, I don't like being cramp in a corner.",positive,ABSA16_Restaurants_Train_SB1_v2.csv
1848,FOOD#QUALITY,"The food we ordered was excellent, although I wouldn't say the margaritas were anything to write home about.",positive,ABSA16_Restaurants_Train_SB1_v2.csv
1861,FOOD#QUALITY,"Overall the food quality was pretty good, though I hear the salmon is much better when it hasn't sat cooling in front of the guest.",positive,ABSA16_Restaurants_Train_SB1_v2.csv
1874,FOOD#QUALITY,"I took one bite from the $24 salmon, and I have never, in the 17 years I have been going to restaurants tasted salmon as fishy, as dry, and as bland as the one in Flatbush Farms.",negative,ABSA16_Restaurants_Train_SB1_v2.csv
1876,FOOD#QUALITY,"So, I switch with my boyfriend again to see if maybe I could stomach the meat and spinach again, but the spinach was so undercooked that I just could not bite through it.",negative,ABSA16_Restaurants_Train_SB1_v2.csv
1879,FOOD#QUALITY,So I decide to report back to the waitress because it was completely inedible.,negative,ABSA16_Restaurants_Train_SB1_v2.csv
1891,FOOD#QUALITY,cirspy crust margherita pizza,positive,ABSA16_Restaurants_Train_SB1_v2.csv
1893,FOOD#QUALITY,it was really good pizza.,positive,ABSA16_Restaurants_Train_SB1_v2.csv
1894,FOOD#QUALITY,the crust was imazingly cooked well and pizza was fully loaded:):):),positive,ABSA16_Restaurants_Train_SB1_v2.csv
1910,FOOD#QUALITY,Great Hot Dogs!,positive,ABSA16_Restaurants_Train_SB1_v2.csv
1912,FOOD#QUALITY,"Though it's been crowded most times I've gone here, Bark always delivers on their food.",positive,ABSA16_Restaurants_Train_SB1_v2.csv
1913,FOOD#QUALITY,"The hot dogs are top notch, and they're Slamwich is amazing!",positive,ABSA16_Restaurants_Train_SB1_v2.csv
1917,FOOD#QUALITY,Fabulous food - if the front of house staff don't put you off –,positive,ABSA16_Restaurants_Train_SB1_v2.csv
1932,FOOD#QUALITY,"The food and service were fine, however the maitre-D was incredibly unwelcoming and arrogant.",positive,ABSA16_Restaurants_Train_SB1_v2.csv
1938,FOOD#QUALITY,Best meal in a long time!,positive,ABSA16_Restaurants_Train_SB1_v2.csv
1939,FOOD#QUALITY,Mussles and calamari were superb Saturday evening.,positive,ABSA16_Restaurants_Train_SB1_v2.csv
1940,FOOD#QUALITY,I had the Lamb special which was perfect.,positive,ABSA16_Restaurants_Train_SB1_v2.csv
1941,FOOD#QUALITY,"My father had the flank steak which was very good, and my mother had the swordfish.",positive,ABSA16_Restaurants_Train_SB1_v2.csv
1943,FOOD#QUALITY,The food is great and the environment is even better.,positive,ABSA16_Restaurants_Train_SB1_v2.csv
1946,FOOD#QUALITY,Taking Hot Dogs to the next level,positive,ABSA16_Restaurants_Train_SB1_v2.csv
1948,FOOD#QUALITY,Here the hot dog is elevated to the level of a real entree with numerous variations available.,positive,ABSA16_Restaurants_Train_SB1_v2.csv
1951,FOOD#QUALITY,"I highly recommend the fish tacos, everything else was ok.",positive,ABSA16_Restaurants_Train_SB1_v2.csv
1964,FOOD#QUALITY,"The food is very good, but not outstanding.",neutral,ABSA16_Restaurants_Train_SB1_v2.csv
1972,FOOD#QUALITY,"The bread was stale, the salad was overpriced and empty.",negative,ABSA16_Restaurants_Train_SB1_v2.csv
1973,FOOD#QUALITY,"The pasta was well cooked, didn't have enough sauce though or flavor.",positive,ABSA16_Restaurants_Train_SB1_v2.csv
1990,FOOD#QUALITY,The food is good.,positive,ABSA16_Restaurants_Train_SB1_v2.csv
0,RESTAURANT#GENERAL,"Judging from previous posts this used to be a good place, but not any longer.",negative,ABSA16_Restaurants_Train_SB1_v2.csv
5,RESTAURANT#GENERAL,Avoid this place!,negative,ABSA16_Restaurants_Train_SB1_v2.csv
7,RESTAURANT#GENERAL,Saul is the best restaurant on Smith Street and in Brooklyn.,positive,ABSA16_Restaurants_Train_SB1_v2.csv
17,RESTAURANT#GENERAL,"Went on a 3 day oyster binge, with Fish bringing up the closing, and I am so glad this was the place it O trip ended, because it was so great!",positive,ABSA16_Restaurants_Train_SB1_v2.csv
19,RESTAURANT#GENERAL,You can't go wrong here.,positive,ABSA16_Restaurants_Train_SB1_v2.csv
20,RESTAURANT#GENERAL,Every time in New York I make it a point to visit Restaurant Saul on Smith Street.,positive,ABSA16_Restaurants_Train_SB1_v2.csv
23,RESTAURANT#GENERAL,Can't wait wait for my next visit.,positive,ABSA16_Restaurants_Train_SB1_v2.csv
25,RESTAURANT#GENERAL,And I hate to say this but I doubt I'll ever go back.,negative,ABSA16_Restaurants_Train_SB1_v2.csv
36,RESTAURANT#GENERAL,we love th pink pony.,positive,ABSA16_Restaurants_Train_SB1_v2.csv
37,RESTAURANT#GENERAL,THe perfect spot.,positive,ABSA16_Restaurants_Train_SB1_v2.csv
41,RESTAURANT#GENERAL,"Don't judge this place prima facie, you have to try it to believe it, a home away from home for the literate heart.",positive,ABSA16_Restaurants_Train_SB1_v2.csv
48,RESTAURANT#GENERAL,"well, i didn't find it there, and trust, i have told everyone i can think of about my experience.",negative,ABSA16_Restaurants_Train_SB1_v2.csv
50,RESTAURANT#GENERAL,This place has got to be the best japanese restaurant in the new york area.,positive,ABSA16_Restaurants_Train_SB1_v2.csv
51,RESTAURANT#GENERAL,I had a great experience.,positive,ABSA16_Restaurants_Train_SB1_v2.csv
54,RESTAURANT#GENERAL,I have been going back again and again.,positive,ABSA16_Restaurants_Train_SB1_v2.csv
65,RESTAURANT#GENERAL,I'm going back.,positive,ABSA16_Restaurants_Train_SB1_v2.csv
70,RESTAURANT#GENERAL,I will be going back and heartily recommend it!,positive,ABSA16_Restaurants_Train_SB1_v2.csv
76,RESTAURANT#GENERAL,Go hungry and enjoy.,positive,ABSA16_Restaurants_Train_SB1_v2.csv
92,RESTAURANT#GENERAL,IT WAS HORRIBLE.,negative,ABSA16_Restaurants_Train_SB1_v2.csv
96,RESTAURANT#GENERAL,This has got to be one of the most overrated restaurants in Brooklyn.,negative,ABSA16_Restaurants_Train_SB1_v2.csv
99,RESTAURANT#GENERAL,"A big disappointment, all around.",negative,ABSA16_Restaurants_Train_SB1_v2.csv
103,RESTAURANT#GENERAL,Worth the trip from Manhattan.,positive,ABSA16_Restaurants_Train_SB1_v2.csv
109,RESTAURANT#GENERAL,"As a Japanese native, I've lived in the Tristate area for over 8 years, but I was just so amazed at this place.",positive,ABSA16_Restaurants_Train_SB1_v2.csv
112,RESTAURANT#GENERAL,This place is worth an one-hour drive.,positive,ABSA16_Restaurants_Train_SB1_v2.csv
113,RESTAURANT#GENERAL,"I am so coming back here again, as much as I can.",positive,ABSA16_Restaurants_Train_SB1_v2.csv
114,RESTAURANT#GENERAL,"Leon is an East Village gem: casual but hip, with well prepared basic French bistro fare, good specials, a warm and lively atmosphere.",positive,ABSA16_Restaurants_Train_SB1_v2.csv
118,RESTAURANT#GENERAL,Have been dozens of times and never failed to enjoy the experience.,positive,ABSA16_Restaurants_Train_SB1_v2.csv
119,RESTAURANT#GENERAL,"Our teenage kids love it, too.",positive,ABSA16_Restaurants_Train_SB1_v2.csv
120,RESTAURANT#GENERAL,"Everytime I decide to try another place on the UES, I get angry that I didn't just go to Zucchero Pomodori.",positive,ABSA16_Restaurants_Train_SB1_v2.csv
121,RESTAURANT#GENERAL,This is by far my favorite place in the neighborhood.,positive,ABSA16_Restaurants_Train_SB1_v2.csv
124,RESTAURANT#GENERAL,I'm partial to the Gnocchi.,positive,ABSA16_Restaurants_Train_SB1_v2.csv
129,RESTAURANT#GENERAL,I just don't understand all the hype...,negative,ABSA16_Restaurants_Train_SB1_v2.csv
136,RESTAURANT#GENERAL,Make sure you try this place as often as you can.,positive,ABSA16_Restaurants_Train_SB1_v2.csv
137,RESTAURANT#GENERAL,This is a fun restaurant to go to.,positive,ABSA16_Restaurants_Train_SB1_v2.csv
144,RESTAURANT#GENERAL,I don't think I would go again.,negative,ABSA16_Restaurants_Train_SB1_v2.csv
145,RESTAURANT#GENERAL,This place is great.,positive,ABSA16_Restaurants_Train_SB1_v2.csv
154,RESTAURANT#GENERAL,I will be back!,positive,ABSA16_Restaurants_Train_SB1_v2.csv
173,RESTAURANT#GENERAL,I have been going there since it opened and I can't get enough.,positive,ABSA16_Restaurants_Train_SB1_v2.csv
186,RESTAURANT#GENERAL,I've been there three times and have always had wonderful experiences.,positive,ABSA16_Restaurants_Train_SB1_v2.csv
188,RESTAURANT#GENERAL,I'm not sure where the other reviewers ate but it seems as if we visited two different restaurants because my friends and I all enjoy Mizu very much... and we're repeat customers.,positive,ABSA16_Restaurants_Train_SB1_v2.csv
206,RESTAURANT#GENERAL,This is one of my favorite restaurants and it is not to be missed.,positive,ABSA16_Restaurants_Train_SB1_v2.csv
207,RESTAURANT#GENERAL,Your friends will thank you for introducing them to this gem!,positive,ABSA16_Restaurants_Train_SB1_v2.csv
208,RESTAURANT#GENERAL,"When we stumbled on Leon, we thought that we had found quite the gem BUT, we were certainly wrong.",negative,ABSA16_Restaurants_Train_SB1_v2.csv
213,RESTAURANT#GENERAL,I had a grat time at Jekyll and Hyde!,positive,ABSA16_Restaurants_Train_SB1_v2.csv
214,RESTAURANT#GENERAL,I loved everythig about it-especially the shows and actors.,positive,ABSA16_Restaurants_Train_SB1_v2.csv
222,RESTAURANT#GENERAL,This was a repeat visit and we'll definitely be back again.,positive,ABSA16_Restaurants_Train_SB1_v2.csv
236,RESTAURANT#GENERAL,A must try!,positive,ABSA16_Restaurants_Train_SB1_v2.csv
237,RESTAURANT#GENERAL,"On a recent Sunday afternoon, a friend and I accidently found this great restaurant on our way to see the pulitzer prize winning play DOUBT.",positive,ABSA16_Restaurants_Train_SB1_v2.csv
240,RESTAURANT#GENERAL,"With so many poor experiences to be had in the theater district, is truly an excellent find!",positive,ABSA16_Restaurants_Train_SB1_v2.csv
241,RESTAURANT#GENERAL,We will return many times for this oasis in mid-town.,positive,ABSA16_Restaurants_Train_SB1_v2.csv
254,RESTAURANT#GENERAL,"All in all, this midtown gem instantly became one of my favorite sushi restaurants in the city.",positive,ABSA16_Restaurants_Train_SB1_v2.csv
261,RESTAURANT#GENERAL,"I've been to at Cafe Spice probably 5-8 times, it is probably still the best Indian restaurant around Union Square.",positive,ABSA16_Restaurants_Train_SB1_v2.csv
267,RESTAURANT#GENERAL,I have NEVER been disappointed in the Red Eye.,positive,ABSA16_Restaurants_Train_SB1_v2.csv
271,RESTAURANT#GENERAL,You cannot go wrong at the Red Eye Grill.,positive,ABSA16_Restaurants_Train_SB1_v2.csv
272,RESTAURANT#GENERAL,"If we were to move from the upper east side, we would genuinely miss this restaurant.",positive,ABSA16_Restaurants_Train_SB1_v2.csv
276,RESTAURANT#GENERAL,I would highly recommend it.,positive,ABSA16_Restaurants_Train_SB1_v2.csv
277,RESTAURANT#GENERAL,It's one of our favorite places to eat in NY.,positive,ABSA16_Restaurants_Train_SB1_v2.csv
278,RESTAURANT#GENERAL,We had a great time at the Jekyll and hyde Pub last night.,positive,ABSA16_Restaurants_Train_SB1_v2.csv
280,RESTAURANT#GENERAL,After really enjoying ourselves at the bar we sat down at a table and had dinner.,positive,ABSA16_Restaurants_Train_SB1_v2.csv
283,RESTAURANT#GENERAL,I highly recommend visiting this restaurant and having dinner and drinks!,positive,ABSA16_Restaurants_Train_SB1_v2.csv
285,RESTAURANT#GENERAL,"My husband and I thougt it would be great to go to the Jekyll and Hyde Pub for our anniversary, and to our surprise it was fantastic.",positive,ABSA16_Restaurants_Train_SB1_v2.csv
