,Aspect,Document,Sentiment,Dataset
2146,LAPTOP#OPERATION_PERFORMANCE,Been using it for about 4 hours now and it seems plenty fast and does everything I need it to do.,positive,ABSA16_Laptops_Train_SB1_v2.csv
2162,LAPTOP#OPERATION_PERFORMANCE,"The i7 is incredibly fast, the RAM makes it proper for several games (not on maximum quality).",positive,ABSA16_Laptops_Train_SB1_v2.csv
2165,LAPTOP#OPERATION_PERFORMANCE,"I use it for school, its quick and has everything I need on it.",positive,ABSA16_Laptops_Train_SB1_v2.csv
2174,LAPTOP#OPERATION_PERFORMANCE,"Its fast, powerful, screen display is top notch and the battery life is excellent for a laptop of this size.",positive,ABSA16_Laptops_Train_SB1_v2.csv
2178,LAPTOP#OPERATION_PERFORMANCE,Works at a decent speed.,neutral,ABSA16_Laptops_Train_SB1_v2.csv
2194,LAPTOP#OPERATION_PERFORMANCE,Very good performer for the price.,positive,ABSA16_Laptops_Train_SB1_v2.csv
2195,LAPTOP#OPERATION_PERFORMANCE,"Not blazing fast, but quick enough.",positive,ABSA16_Laptops_Train_SB1_v2.csv
2210,LAPTOP#OPERATION_PERFORMANCE,it stopped working 31 days after purchase.,negative,ABSA16_Laptops_Train_SB1_v2.csv
2213,LAPTOP#OPERATION_PERFORMANCE,it was slow and might be problematic.,negative,ABSA16_Laptops_Train_SB1_v2.csv
2215,LAPTOP#OPERATION_PERFORMANCE,CRASHED only 2 days from getting it!!!!,negative,ABSA16_Laptops_Train_SB1_v2.csv
2219,LAPTOP#OPERATION_PERFORMANCE,"The PC is works well with a good battery and a power cable, and has a web cam.",positive,ABSA16_Laptops_Train_SB1_v2.csv
2234,LAPTOP#OPERATION_PERFORMANCE,Functions well.,positive,ABSA16_Laptops_Train_SB1_v2.csv
2243,LAPTOP#OPERATION_PERFORMANCE,3.Fairly fast.,positive,ABSA16_Laptops_Train_SB1_v2.csv
2248,LAPTOP#OPERATION_PERFORMANCE,Battery power laptop had difficulties computing.,negative,ABSA16_Laptops_Train_SB1_v2.csv
2257,LAPTOP#OPERATION_PERFORMANCE,This clunker however stopped working after only two weeks of having it delivered.,negative,ABSA16_Laptops_Train_SB1_v2.csv
2258,LAPTOP#OPERATION_PERFORMANCE,It would have a full charge yet would turn itself off for no explainable reason after being on for 5 minutes.,negative,ABSA16_Laptops_Train_SB1_v2.csv
2260,LAPTOP#OPERATION_PERFORMANCE,"The second one, after a little over a month, refused to turn on even with a full charge.",negative,ABSA16_Laptops_Train_SB1_v2.csv
2265,LAPTOP#OPERATION_PERFORMANCE,It takes a long time to load any page.,negative,ABSA16_Laptops_Train_SB1_v2.csv
2266,LAPTOP#OPERATION_PERFORMANCE,I've had it for a minth and so far it's shut down completely 3 times.,negative,ABSA16_Laptops_Train_SB1_v2.csv
2275,LAPTOP#OPERATION_PERFORMANCE,I am not ultra tech savvy but I can tell when it works slow!,negative,ABSA16_Laptops_Train_SB1_v2.csv
2277,LAPTOP#OPERATION_PERFORMANCE,I barely have any files or downloads and its almost impossible to get this thing to load.,negative,ABSA16_Laptops_Train_SB1_v2.csv
2298,LAPTOP#OPERATION_PERFORMANCE,"It is quite impressive at multitasking, which really surprised me.",positive,ABSA16_Laptops_Train_SB1_v2.csv
2299,LAPTOP#OPERATION_PERFORMANCE,I can have tabs open while playing YouTube videos and it handles it impressively well.,positive,ABSA16_Laptops_Train_SB1_v2.csv
2304,LAPTOP#OPERATION_PERFORMANCE,this computer is very slow,negative,ABSA16_Laptops_Train_SB1_v2.csv
2317,LAPTOP#OPERATION_PERFORMANCE,"In all my life i have never come across a computer as slow as this one, it cant perform basic operations and is practically useless.",negative,ABSA16_Laptops_Train_SB1_v2.csv
2318,LAPTOP#OPERATION_PERFORMANCE,I just received the laptop and if it runs like this already cant imagine how it would work in the next couple of weeks.,negative,ABSA16_Laptops_Train_SB1_v2.csv
2319,LAPTOP#OPERATION_PERFORMANCE,It took almost 20 minutes to boot up.,negative,ABSA16_Laptops_Train_SB1_v2.csv
2341,LAPTOP#OPERATION_PERFORMANCE,Although it was slow but I felt it was ok for the price you have bought it.,negative,ABSA16_Laptops_Train_SB1_v2.csv
2343,LAPTOP#OPERATION_PERFORMANCE,Laptop automatically shuts down when battery life reaches 30%.,negative,ABSA16_Laptops_Train_SB1_v2.csv
2348,LAPTOP#OPERATION_PERFORMANCE,The laptop is fast.,positive,ABSA16_Laptops_Train_SB1_v2.csv
2350,LAPTOP#OPERATION_PERFORMANCE,Now I have dual booted my laptop to Windows 8.1 and Ubuntu 14.04 and it's not got too slow either.,positive,ABSA16_Laptops_Train_SB1_v2.csv
2359,LAPTOP#OPERATION_PERFORMANCE,"But, it works really slowwwwww!!!",negative,ABSA16_Laptops_Train_SB1_v2.csv
2360,LAPTOP#OPERATION_PERFORMANCE,It has got me feel like to take years to successfully open a web page.,negative,ABSA16_Laptops_Train_SB1_v2.csv
2383,LAPTOP#OPERATION_PERFORMANCE,"It hangs, freezes and just isn't working properly.",negative,ABSA16_Laptops_Train_SB1_v2.csv
2384,LAPTOP#OPERATION_PERFORMANCE,I have now been waiting almost a minute for the computer management window to open!,negative,ABSA16_Laptops_Train_SB1_v2.csv
2390,LAPTOP#OPERATION_PERFORMANCE,Very fast and good for most steam games.,positive,ABSA16_Laptops_Train_SB1_v2.csv
2466,LAPTOP#OPERATION_PERFORMANCE,Now the speed is disappointing.,negative,ABSA16_Laptops_Train_SB1_v2.csv
2467,LAPTOP#OPERATION_PERFORMANCE,"Start up is fine  maybe 20 secs at most, but then to get pages to load on internet is molasses at times.",negative,ABSA16_Laptops_Train_SB1_v2.csv
2468,LAPTOP#OPERATION_PERFORMANCE,Even for a 4GB RAM it barely chugs with 3 tabs open.,negative,ABSA16_Laptops_Train_SB1_v2.csv
2488,LAPTOP#OPERATION_PERFORMANCE,The laptop is very responsice with the Core i7 processor and 8GB of RAM and the sound out of the Beats audio is great.,positive,ABSA16_Laptops_Train_SB1_v2.csv
2489,LAPTOP#OPERATION_PERFORMANCE,I would highly recommend this product to anyone looking for a top performing laptop.,positive,ABSA16_Laptops_Train_SB1_v2.csv
2494,LAPTOP#OPERATION_PERFORMANCE,"The Dell is quick enough, sturdy, not good with finger prints.",positive,ABSA16_Laptops_Train_SB1_v2.csv
2498,LAPTOP#OPERATION_PERFORMANCE,"I bought this for my daughter to use for school and homework, it's not a ""fast"" computer, but it's great for what she needs it for and very light weight!",neutral,ABSA16_Laptops_Train_SB1_v2.csv
1,LAPTOP#OPERATION_PERFORMANCE,"Works well, fast and no reboots.",,EN_LAPT_SB1_TEST_.B.csv
5,LAPTOP#OPERATION_PERFORMANCE,s.... L .... o..... w....  rea......llllyy  slow.,,EN_LAPT_SB1_TEST_.B.csv
6,LAPTOP#OPERATION_PERFORMANCE,like seriously  - really slow.,,EN_LAPT_SB1_TEST_.B.csv
31,LAPTOP#OPERATION_PERFORMANCE,"Overall, this is a fast, light, practical computer and I highly recommend it.",,EN_LAPT_SB1_TEST_.B.csv
40,LAPTOP#OPERATION_PERFORMANCE,The thing wakes up super fast and is always ready to go.,,EN_LAPT_SB1_TEST_.B.csv
45,LAPTOP#OPERATION_PERFORMANCE,it runs fast!,,EN_LAPT_SB1_TEST_.B.csv
68,LAPTOP#OPERATION_PERFORMANCE,It has so much more speed and the screen is very sharp.,,EN_LAPT_SB1_TEST_.B.csv
90,LAPTOP#OPERATION_PERFORMANCE,"Within a day of usage, it already slowed down significantly, virus entered the system right away.",,EN_LAPT_SB1_TEST_.B.csv
96,LAPTOP#OPERATION_PERFORMANCE,"My Apple mac book pro has crashed three times, since I purchased it.",,EN_LAPT_SB1_TEST_.B.csv
109,LAPTOP#OPERATION_PERFORMANCE,I can say that I am fully satisfied with the performance that the computer has supplied.,,EN_LAPT_SB1_TEST_.B.csv
134,LAPTOP#OPERATION_PERFORMANCE,"We don't have to de-frag, deliete cookies, run security programs, or any of the common PC problems that have to be delt with in order to keep you running and up to speed.",,EN_LAPT_SB1_TEST_.B.csv
149,LAPTOP#OPERATION_PERFORMANCE,It runs faster than it did when I got it.,,EN_LAPT_SB1_TEST_.B.csv
160,LAPTOP#OPERATION_PERFORMANCE,"It takes less time to power up, and if you just close the case it go into sleep mode.",,EN_LAPT_SB1_TEST_.B.csv
161,LAPTOP#OPERATION_PERFORMANCE,WHen you open it wakes up almost immediately.,,EN_LAPT_SB1_TEST_.B.csv
198,LAPTOP#OPERATION_PERFORMANCE,Very quick to get it up and running with a minimum setup time right after you open the box.,,EN_LAPT_SB1_TEST_.B.csv
204,LAPTOP#OPERATION_PERFORMANCE,The first one arrived and it did not work.,,EN_LAPT_SB1_TEST_.B.csv
227,LAPTOP#OPERATION_PERFORMANCE,I've been using Apple's since 1992 and this is the fastest and best one I've  had.,,EN_LAPT_SB1_TEST_.B.csv
233,LAPTOP#OPERATION_PERFORMANCE,"This is very fast, high performance computer.",,EN_LAPT_SB1_TEST_.B.csv
236,LAPTOP#OPERATION_PERFORMANCE,It fast and easy to set up.,,EN_LAPT_SB1_TEST_.B.csv
248,LAPTOP#OPERATION_PERFORMANCE,"- Quick boot-up, and runs efficiently.",,EN_LAPT_SB1_TEST_.B.csv
264,LAPTOP#OPERATION_PERFORMANCE,It wakes in less than a second when I open the lid.,,EN_LAPT_SB1_TEST_.B.csv
385,LAPTOP#OPERATION_PERFORMANCE,Machine is flying and with parallels desktop 8 I have my old PC notebook completely functional on my MBP.,,EN_LAPT_SB1_TEST_.B.csv
400,LAPTOP#OPERATION_PERFORMANCE,All works beautifully but Windows 8 is taking a bit of getting used to.,,EN_LAPT_SB1_TEST_.B.csv
438,LAPTOP#OPERATION_PERFORMANCE,This thing boots in just a few seconds which is nice.,,EN_LAPT_SB1_TEST_.B.csv
442,LAPTOP#OPERATION_PERFORMANCE,"Boot time is super fast, around anywhere from 35 seconds to 1 minute.",,EN_LAPT_SB1_TEST_.B.csv
479,LAPTOP#OPERATION_PERFORMANCE,Very pour performance.,,EN_LAPT_SB1_TEST_.B.csv
480,LAPTOP#OPERATION_PERFORMANCE,It takes for ever to wake it up.,,EN_LAPT_SB1_TEST_.B.csv
482,LAPTOP#OPERATION_PERFORMANCE,It is very slow and not responsive.,,EN_LAPT_SB1_TEST_.B.csv
487,LAPTOP#OPERATION_PERFORMANCE,"I tested it, it worked great.",,EN_LAPT_SB1_TEST_.B.csv
489,LAPTOP#OPERATION_PERFORMANCE,"The laptop refuses to start, we have troubleshooted all areas, still fails to start.",,EN_LAPT_SB1_TEST_.B.csv
490,LAPTOP#OPERATION_PERFORMANCE,Cannot even get to bios.,,EN_LAPT_SB1_TEST_.B.csv
491,LAPTOP#OPERATION_PERFORMANCE,Just a click and a BLACK SCREEN.,,EN_LAPT_SB1_TEST_.B.csv
494,LAPTOP#OPERATION_PERFORMANCE,We got two days of operation from this laptop.,,EN_LAPT_SB1_TEST_.B.csv
505,LAPTOP#OPERATION_PERFORMANCE,The machine now has 10 gigs of RAM and it works just fine.,,EN_LAPT_SB1_TEST_.B.csv
522,LAPTOP#OPERATION_PERFORMANCE,Three years ago I had purchased this bad boy and it still runs great!,,EN_LAPT_SB1_TEST_.B.csv
531,LAPTOP#OPERATION_PERFORMANCE,"Cons.  1. If you fall behind in updates, your laptop will become progressively slower, just update it...then its back to normal",,EN_LAPT_SB1_TEST_.B.csv
532,LAPTOP#OPERATION_PERFORMANCE,"2. Sometimes when I stared mine up it would take a few extra minutes to boot on, other times it is a few seconds",,EN_LAPT_SB1_TEST_.B.csv
535,LAPTOP#OPERATION_PERFORMANCE,"Mine has been though hundreds of parties, weddings, quinces, anything involving performances, it can take it!",,EN_LAPT_SB1_TEST_.B.csv
587,LAPTOP#OPERATION_PERFORMANCE,"Pros:  o It usually runs very smoothly, but Apple has an excellent support team that is always willing to help customers.",,EN_LAPT_SB1_TEST_.B.csv
605,LAPTOP#OPERATION_PERFORMANCE,Computer seemed sluggish for an Intel Core i5 device.,,EN_LAPT_SB1_TEST_.B.csv
610,LAPTOP#OPERATION_PERFORMANCE,"Runs fast, the touch screen hasn't lost any sensitivity, I'm overall very happy with it.",,EN_LAPT_SB1_TEST_.B.csv
673,LAPTOP#OPERATION_PERFORMANCE,"I still have weird freezing problems with it and it's pretty slow, but it's not pinpointed enough yet for me to take it in.",,EN_LAPT_SB1_TEST_.B.csv
692,LAPTOP#OPERATION_PERFORMANCE,"Well she was right, Whatever in the world took me so long to get a computer that just works.",,EN_LAPT_SB1_TEST_.B.csv
702,LAPTOP#OPERATION_PERFORMANCE,"The MacBook Pro 13.3 inch laptop is for those who want to use a Mac, but value performance and upgradability over weight and screen resolution.",,EN_LAPT_SB1_TEST_.B.csv
756,LAPTOP#OPERATION_PERFORMANCE,"Before and after I resolved that issue, I saw the damn 'beachball' all the time as the computer tries to figure out what the hell it's doing while I wait for it.",,EN_LAPT_SB1_TEST_.B.csv
757,LAPTOP#OPERATION_PERFORMANCE,I spend so much time waiting for it.,,EN_LAPT_SB1_TEST_.B.csv
761,LAPTOP#OPERATION_PERFORMANCE,"Now that they are not virus free ([...]l) I see absolutely no benefit to Apple products as they are slower, more expensive, and do not last as long.",,EN_LAPT_SB1_TEST_.B.csv
794,LAPTOP#OPERATION_PERFORMANCE,From time to time I get the 'spinning beach ball' that holds up progress.,,EN_LAPT_SB1_TEST_.B.csv
14,LAPTOP#DESIGN_FEATURES,"without a big ol' clunky machine in my backpack, I feel like I can do programming homework anywhere.",positive,ABSA16_Laptops_Train_SB1_v2.csv
18,LAPTOP#DESIGN_FEATURES,My HP is very heavy.,negative,ABSA16_Laptops_Train_SB1_v2.csv
60,LAPTOP#DESIGN_FEATURES,I'm already hooked on the sleek look and dependability that this laptop has shown.,positive,ABSA16_Laptops_Train_SB1_v2.csv
62,LAPTOP#DESIGN_FEATURES,The unibody design is edgy and durable.,positive,ABSA16_Laptops_Train_SB1_v2.csv
66,LAPTOP#DESIGN_FEATURES,A key contributor that led me to Mac is the art aspect.,positive,ABSA16_Laptops_Train_SB1_v2.csv
73,LAPTOP#DESIGN_FEATURES,It had most of the features and all of the power that I wanted to replace my desktop machine.,positive,ABSA16_Laptops_Train_SB1_v2.csv
74,LAPTOP#DESIGN_FEATURES,I wasn't really as concerned about portability (it's a very large laptop) but it's not hard to move around or take on a trip which was a pleasant surprise.,neutral,ABSA16_Laptops_Train_SB1_v2.csv
76,LAPTOP#DESIGN_FEATURES,"I love the size, keyboard, the functions.",positive,ABSA16_Laptops_Train_SB1_v2.csv
100,LAPTOP#DESIGN_FEATURES,There are so many wonderful features and benefits to the new MacBook!,positive,ABSA16_Laptops_Train_SB1_v2.csv
181,LAPTOP#DESIGN_FEATURES,"the features are great, the only thing it needs is better speakers.",positive,ABSA16_Laptops_Train_SB1_v2.csv
182,LAPTOP#DESIGN_FEATURES,Small and light weight.,positive,ABSA16_Laptops_Train_SB1_v2.csv
189,LAPTOP#DESIGN_FEATURES,"The design is awesome, quality is unprecedented.",positive,ABSA16_Laptops_Train_SB1_v2.csv
196,LAPTOP#DESIGN_FEATURES,The black model also has a very nice seamless appearance - one of the better looking notebooks I've seen.,positive,ABSA16_Laptops_Train_SB1_v2.csv
202,LAPTOP#DESIGN_FEATURES,"Laptop is advertised as a 15"" but the casing looks like that of a 17"".",negative,ABSA16_Laptops_Train_SB1_v2.csv
203,LAPTOP#DESIGN_FEATURES,This laptop is very large and barely fits in any carrying cases.,negative,ABSA16_Laptops_Train_SB1_v2.csv
273,LAPTOP#DESIGN_FEATURES,"Besides the great look, it is a great machine.",positive,ABSA16_Laptops_Train_SB1_v2.csv
279,LAPTOP#DESIGN_FEATURES,"I also love the small, convenient size of my laptop, making it a perfect tool for my academic studies.",positive,ABSA16_Laptops_Train_SB1_v2.csv
310,LAPTOP#DESIGN_FEATURES,This is a nicely sized laptop with lots of processing power and long battery life.,positive,ABSA16_Laptops_Train_SB1_v2.csv
376,LAPTOP#DESIGN_FEATURES,"Other installed features, such as certain printer software, are also most attractive.",positive,ABSA16_Laptops_Train_SB1_v2.csv
389,LAPTOP#DESIGN_FEATURES,It's so nice to look at and the keys are easy to type with.,positive,ABSA16_Laptops_Train_SB1_v2.csv
443,LAPTOP#DESIGN_FEATURES,I took off a star because the machine has a lot of junk software on it.,negative,ABSA16_Laptops_Train_SB1_v2.csv
444,LAPTOP#DESIGN_FEATURES,I wish Toshiba would allow their customers to select an option that only boots the OS at setup and removes all the unnecessary stuff.,negative,ABSA16_Laptops_Train_SB1_v2.csv
451,LAPTOP#DESIGN_FEATURES,Right size and weight for portability.,positive,ABSA16_Laptops_Train_SB1_v2.csv
458,LAPTOP#DESIGN_FEATURES,"Otherwise, all other features are a 1",positive,ABSA16_Laptops_Train_SB1_v2.csv
460,LAPTOP#DESIGN_FEATURES,"lightweight, long battery life, excellent transition from PC;",positive,ABSA16_Laptops_Train_SB1_v2.csv
476,LAPTOP#DESIGN_FEATURES,"This purchase opened me to the world of Macbooks, and I am impressed with the intuition of the design, the beauty of the product, and the excellent technological advances associated with it.",positive,ABSA16_Laptops_Train_SB1_v2.csv
486,LAPTOP#DESIGN_FEATURES,I am first time Mac Buyer and am amazed at features and ease of use the Mac offers.,positive,ABSA16_Laptops_Train_SB1_v2.csv
506,LAPTOP#DESIGN_FEATURES,"It has no camera but, I can always buy and install one easy.",neutral,ABSA16_Laptops_Train_SB1_v2.csv
521,LAPTOP#DESIGN_FEATURES,"It doesn't have a lot of frills, but I didn't need any, and being able to buy what I needed, and not more than I needed was very important.",neutral,ABSA16_Laptops_Train_SB1_v2.csv
522,LAPTOP#DESIGN_FEATURES,This computer I used daily nice compact design.,positive,ABSA16_Laptops_Train_SB1_v2.csv
535,LAPTOP#DESIGN_FEATURES,My favorite part of this computer is that it has a vga port so I can connect it to a bigger screen.,positive,ABSA16_Laptops_Train_SB1_v2.csv
544,LAPTOP#DESIGN_FEATURES,"I also love the design, the looks, the feel, and the my toshiba feature is wonderfull.",positive,ABSA16_Laptops_Train_SB1_v2.csv
551,LAPTOP#DESIGN_FEATURES,I would like to have volume buttons rather than the adjustment that is on the front.,negative,ABSA16_Laptops_Train_SB1_v2.csv
557,LAPTOP#DESIGN_FEATURES,Features like the font are very block-like and old school.,negative,ABSA16_Laptops_Train_SB1_v2.csv
558,LAPTOP#DESIGN_FEATURES,"Would like more trendy, high tech features.",negative,ABSA16_Laptops_Train_SB1_v2.csv
561,LAPTOP#DESIGN_FEATURES,Came fully loaded - good.,positive,ABSA16_Laptops_Train_SB1_v2.csv
567,LAPTOP#DESIGN_FEATURES,"The laptop is very lightweight, can easily carry around in a knapsack full of text books and it barely adds any weight.",positive,ABSA16_Laptops_Train_SB1_v2.csv
568,LAPTOP#DESIGN_FEATURES,It is small enough to fit in one of my purses!,positive,ABSA16_Laptops_Train_SB1_v2.csv
602,LAPTOP#DESIGN_FEATURES,It has all the features that are necessary for college and if not they are able to be added onto the computer.,positive,ABSA16_Laptops_Train_SB1_v2.csv
604,LAPTOP#DESIGN_FEATURES,It is sleek and lightweight and charges quickly when needed.,positive,ABSA16_Laptops_Train_SB1_v2.csv
605,LAPTOP#DESIGN_FEATURES,Its white color is stylish for college students and easy to take to carry and take to classes.,positive,ABSA16_Laptops_Train_SB1_v2.csv
618,LAPTOP#DESIGN_FEATURES,"It has many great programs, such as ILife, iPhotos and others.",positive,ABSA16_Laptops_Train_SB1_v2.csv
664,LAPTOP#DESIGN_FEATURES,"I get a ton of compliments on its size, and speaking as someone who regularly commutes on a bus, I can attest to the fact that this is the perfect size computer if you're restricted to the width of your body for computing room.",positive,ABSA16_Laptops_Train_SB1_v2.csv
674,LAPTOP#DESIGN_FEATURES,Everything from the design to the OS is simple and to the point.,positive,ABSA16_Laptops_Train_SB1_v2.csv
681,LAPTOP#DESIGN_FEATURES,lots of preloaded software.,positive,ABSA16_Laptops_Train_SB1_v2.csv
686,LAPTOP#DESIGN_FEATURES,Maybe not the cutting edge (Satellite L455D) but it is a workhorse.,neutral,ABSA16_Laptops_Train_SB1_v2.csv
692,LAPTOP#DESIGN_FEATURES,"Not super fancy, but not super expensive either.",neutral,ABSA16_Laptops_Train_SB1_v2.csv
715,LAPTOP#DESIGN_FEATURES,"It even has a great webcam, and Skype works very well.",positive,ABSA16_Laptops_Train_SB1_v2.csv
724,LAPTOP#DESIGN_FEATURES,"the hinge design forced you to place various connections all around the computer, left right and front.",negative,ABSA16_Laptops_Train_SB1_v2.csv
726,LAPTOP#DESIGN_FEATURES,Cords coming out the right for power plus cords coming out front for headphones/mic plus network connection on left make for a very messy setup with cords going every direction.,negative,ABSA16_Laptops_Train_SB1_v2.csv
770,LAPTOP#DESIGN_FEATURES,"The Unibody construction is solid, sleek and beautiful.",positive,ABSA16_Laptops_Train_SB1_v2.csv
771,LAPTOP#DESIGN_FEATURES,"It is everything I'd hoped it would be from a look and feel standpoint, but somehow a bit more sturdy.",positive,ABSA16_Laptops_Train_SB1_v2.csv
804,LAPTOP#DESIGN_FEATURES,That is my only complaint!,negative,ABSA16_Laptops_Train_SB1_v2.csv
820,LAPTOP#DESIGN_FEATURES,It is also extremely pleasing to the eyes without looking too much like an Alienware gaming machine.,positive,ABSA16_Laptops_Train_SB1_v2.csv
822,LAPTOP#DESIGN_FEATURES,It is a bit heavy.,negative,ABSA16_Laptops_Train_SB1_v2.csv
825,LAPTOP#DESIGN_FEATURES,Had some trouble finding a case that it would fit in.,negative,ABSA16_Laptops_Train_SB1_v2.csv
826,LAPTOP#DESIGN_FEATURES,"This is an over-sized, 18-inch laptop.",negative,ABSA16_Laptops_Train_SB1_v2.csv
829,LAPTOP#DESIGN_FEATURES,It wouldn't fit in most 17-inch bags.,negative,ABSA16_Laptops_Train_SB1_v2.csv
831,LAPTOP#DESIGN_FEATURES,It also does not have bluetooth.,negative,ABSA16_Laptops_Train_SB1_v2.csv
833,LAPTOP#DESIGN_FEATURES,You'll need to upgrade and pay a little more for them.,negative,ABSA16_Laptops_Train_SB1_v2.csv
835,LAPTOP#DESIGN_FEATURES,"I was looking too closely at the other performance specs and while comparing, I took it for granted that these features were standard.",negative,ABSA16_Laptops_Train_SB1_v2.csv
846,LAPTOP#DESIGN_FEATURES,Im glad that it has such great features in it.,positive,ABSA16_Laptops_Train_SB1_v2.csv
847,LAPTOP#DESIGN_FEATURES,It also came with a built it web cam which is great because I can see an communicate with my family members back home.,positive,ABSA16_Laptops_Train_SB1_v2.csv
887,LAPTOP#DESIGN_FEATURES,It is light and the battery last a very long time.,positive,ABSA16_Laptops_Train_SB1_v2.csv
921,LAPTOP#DESIGN_FEATURES,Plus stylish.,positive,ABSA16_Laptops_Train_SB1_v2.csv
934,LAPTOP#DESIGN_FEATURES,"I did think it had a camera because that was one of my requirements, but forgot to check in the specifications on this one before I purchased.",negative,ABSA16_Laptops_Train_SB1_v2.csv
935,LAPTOP#DESIGN_FEATURES,So I'm disappointed in that because communicating with my relatives out of the area is a priority.,negative,ABSA16_Laptops_Train_SB1_v2.csv
957,LAPTOP#DESIGN_FEATURES,"It is sleek, smooth, and lightweight.",positive,ABSA16_Laptops_Train_SB1_v2.csv
972,LAPTOP#DESIGN_FEATURES,The notebook is lacking a HDMI port and a S-video port that would enable one to hook it to a TV.,negative,ABSA16_Laptops_Train_SB1_v2.csv
979,LAPTOP#DESIGN_FEATURES,"I wish it had a webcam though, then it would be perfect!",negative,ABSA16_Laptops_Train_SB1_v2.csv
985,LAPTOP#DESIGN_FEATURES,wonderful features.,positive,ABSA16_Laptops_Train_SB1_v2.csv
1004,LAPTOP#DESIGN_FEATURES,The feature are good enough for what I need.,positive,ABSA16_Laptops_Train_SB1_v2.csv
1011,LAPTOP#DESIGN_FEATURES,Not to mention the fact that your mac comes fully loaded with all necessary basic programs.,positive,ABSA16_Laptops_Train_SB1_v2.csv
1023,LAPTOP#DESIGN_FEATURES,Only thing I would want to add to this is an internal bluray read/write drive.,neutral,ABSA16_Laptops_Train_SB1_v2.csv
1024,LAPTOP#DESIGN_FEATURES,But other than that I am blown away by all the features this laptop offers.,positive,ABSA16_Laptops_Train_SB1_v2.csv
1114,LAPTOP#DESIGN_FEATURES,"I love the size because the screen is big enough for what I use it for (Internet, artwork), and yet it is small enough to be reasonably portable.",positive,ABSA16_Laptops_Train_SB1_v2.csv
1210,LAPTOP#DESIGN_FEATURES,The only bad part is the size/weight.,negative,ABSA16_Laptops_Train_SB1_v2.csv
1217,LAPTOP#DESIGN_FEATURES,It's color is even cool.,positive,ABSA16_Laptops_Train_SB1_v2.csv
1236,LAPTOP#DESIGN_FEATURES,for being so small it is amazing that it is as fast as it is.,neutral,ABSA16_Laptops_Train_SB1_v2.csv
1237,LAPTOP#DESIGN_FEATURES,when i first got it i thought the size of it was a joke.,neutral,ABSA16_Laptops_Train_SB1_v2.csv
1238,LAPTOP#DESIGN_FEATURES,but after i got used to it i love it.,positive,ABSA16_Laptops_Train_SB1_v2.csv
1239,LAPTOP#DESIGN_FEATURES,the size of has actually help me out quite a bit by me being able to fit it in an already full backpack and to use it at a resturant where the food on the table is always so space consuming.,positive,ABSA16_Laptops_Train_SB1_v2.csv
1240,LAPTOP#DESIGN_FEATURES,"it has 3 usb ports, 1 sd memory card reader and an sd memory car expansion.",positive,ABSA16_Laptops_Train_SB1_v2.csv
1241,LAPTOP#DESIGN_FEATURES,the only down fall is that it has no cd drive but i found that they are very cheap to by and also very portable making this the best friend to someone who is always looking for more space then they have.,neutral,ABSA16_Laptops_Train_SB1_v2.csv
1262,LAPTOP#DESIGN_FEATURES,"what an elegant, wonderful machine.",positive,ABSA16_Laptops_Train_SB1_v2.csv
1276,LAPTOP#DESIGN_FEATURES,i spent eight hundred dollars from a giant paper weight that looks good on a bus.,neutral,ABSA16_Laptops_Train_SB1_v2.csv
1328,LAPTOP#DESIGN_FEATURES,I paid about 18000 for this laptop because of all the bells and whistles and it kept crapping out on me.,negative,ABSA16_Laptops_Train_SB1_v2.csv
1370,LAPTOP#DESIGN_FEATURES,"I am not going to sit here and complain about it not having a cd drive and what not because it is a netbook, it is made to be compact and if you want all the other stuff get a laptop.",neutral,ABSA16_Laptops_Train_SB1_v2.csv
1396,LAPTOP#DESIGN_FEATURES,This computer had exactly the specifications I needed.,positive,ABSA16_Laptops_Train_SB1_v2.csv
1397,LAPTOP#DESIGN_FEATURES,"Small enough to use on a long flight, Light enough to carry through airports and powerful enough to replace my desktop while on long business trips.",positive,ABSA16_Laptops_Train_SB1_v2.csv
1425,LAPTOP#DESIGN_FEATURES,"Apple is always great about the aesthetics of things, they always come up with good looking products.",positive,ABSA16_Laptops_Train_SB1_v2.csv
1447,LAPTOP#DESIGN_FEATURES,i love the size of the computer since i play games on it.,positive,ABSA16_Laptops_Train_SB1_v2.csv
