Document;Score
My daughters have both enjoyed playing this game. One of them is 6 yrs. old and the other is 3 1/2 yrs. old. and they both have had no trouble mastering this game. The down side to this game is that it is redundant/repeatitive. It is the same things over and over again, only you can change the patterns and colors of the items you are working on. In order to be able to play again after you have completed it, you must go and remove their name from the sign-in page 'then' retype it! This little chore is very annoying after awhile. The graphics are very nice and colorful and it does allow your child to use her imagination and to be creative, but all in all , I think the game was way too pricey for what it is. After having this in our house for 4 months, my girls have become rather bored with it. ;3.0
"This book is both a history and a photo album of the famous German battleship, and the photos are particularly useful in showing both the construction stages of the ship and for the many interior shots. That said, this book has a couple of problems. One is its age; it was originally published in 1975, and the authors appear not to have taken advantage of the information that appears in Ludovic Kennedy's 'Pursuit,' published the previous year. As a result, there are statements in this book, particularly concerning the Bismarck's chronology, that have been disproved by more recent discoveries. The other big problem is the translation, which appears to have been done very literally by someone with little knowledge of naval nomenclature. Thus, 'Seekriegsleitung' gets translated as 'sea-war-leadership,' which may be a literal translation, but ignores the more generic term 'naval operations,' which is what this really means. This problem becomes particularly aggravating in trying to follow the time-line of events surrounding the destruction of the Hood and the Bismarck, which, as translated, make almost no sense. The diagrams, which are in German and are not translated, seem fairly accurate, although during the destruction of the Bismarck they appear to show the King George V firing torpedos at the Bismarck, when in fact the King George V had no torpedo tubes. It's also puzzling that the translator, according to the note at the end of the book, was unaware until 1989, with the publication of Robert Ballard's book on the discovery of the Bismarck, of the number of German sailors rescued after the sinking of the Bismarck. Even here, his figures are wrong--he states that 115 men were rescued by the British. In fact, British warships rescued 111 men (one later died and was buried at sea) while a German submarine and a German weather ship rescued the other five. A marginally useful book, although much of its information has been supersceded by more recent discoveries and research. ";3.0
The plot and outline was good, just the writing needed a bit of work. Things were repeated over and over through out the story and became redundant. Talk of children playing with dogs and such. Also there wasn't a good transition in Tess's attitude. She is weepy and scared, but when she gets there she is couragous, makes a speech and confronts a steward? This was okay, but other Avon True Romance books are better. Nicola and the Viscount, and Anna and the Duke being my favorites. ;3.0
Tess Lindsay has spent most of her life on an island of the Highlands. When Colin MacPherson ends up shipwrecked there, it starts to get interesting. She tells him all she remembers about herself and her old life. Finally she takes out a token, what she clenching when she arrived on the island, he realizes who she really is. An heir to the Lindsay clan in the highlands, for she is Theresa Catherine Lindsay. Her mother was a lowlander and her father was murdered. When they arrive they find out that her father's murderer, is after Tess still. She see's the face of him and when she visits her mother she sees him again. Colin follows her there to protect her but wonders if he will ever see her again. Will he? What will happen with the murderer see's Tess? Read the book to find out. ;3.0
In my opinion Tess and the Highlander is a romantic construction. There is conflict, courage and loyalty in this novel. It is tremendously readable and has unforgettable characters. ;3.0
This is a good pure strategy game but it has one defect that limits it for older players. The Original Gobblet is 4x4 and is a fun complex sophisticated strategy game, but it's also a long game not suited to 6 year olds just getting started in board games. Gobblet Junior looked like great idea when I bought it. 3x3 meant games would end quickly but teach the basic stategy. Perfect for a 6 year old.The problem is that the person who goes first can force the win. This force is not perfectly simple as it not a pre-determined set of moves but is rather like a predetermined set of responses. So if you can memorize chess openings or checker openings then you can always win this game.The good news is that until the child comes to realize this and seek tat solution it is a good game a teaching how to think several moves ahead. it is fun. But eventually one realizes it is a won game and a lot of the fascination is lost. So it's good training for many month, then you need to buy a 4x4. ;2.0
The original Outrun is a timeless classic. It's one of those video-games that will last forever and it came out of the golden era of wonderful arcade innovations, along with Double Dragon and Splatterhouse. Outrun was the first great racer, better than Pole Position on the Atari!!!There have been plenty of sequels and spin-offs to Outrun from the kinda okay Turbo Outrun to the just plain stupid Battle Outrun. None really had that extra spark which made the original so amazing. Outrun 2006 may not end up a classic but is still a brilliant game in it's own right.Rekindling that hedonistic, free-spirited, just-get-in-and-drive-anywhere feeling and sacrificing all the modern racing features for just sheer joyriding pleasure, Outrun 2006 is just such an easily accessible game for anyone.As usual it's filled with gorgeous scenery, brilliantly blue skies and amazing music. The classic 'Magical Sound Shower' (a great, great tune indeed) has been remixed but it also contains the 1986 mix for the purists.The only negative thing I can say about this game is that once you've finished it 5 times (such as I have already) there's not much point in going back to the same old courses. They could have included more.Ah well, it's still a game you should invest time and money in.Graphics ASound AGameplay ALasting Appeal C+ ;3.0
To read this book you need to be fully awake and have full concentration. This is not the type of book to bring to the beach. Though Richard Hofstadter makes a convincing case of what colonial times were like and he obviously was a scholar, he writes very monotonously. if not thouroughly interested in american history at 1750 i would not recommend this book. otherwise, if you are a history-fanatic, this book gives a wide range of perspectives and fully covers the history of the time. ;2.0
"Below is a cut-and-paste of a review I wrote for this original version of the Nuvinci CVP internally gearedhub. I, too, built mine into a downhill-rated 36-hole rim (although with triple-butted tandem-rated spokes), and installed it on an Xtracycle cargo bike conversion. I'm reposting this review here because this item consistently comes up on the top of my Amazon searches for 'Xtracycle.'I don't have much of anything to add to this prologue; I pretty much couldn't have reviewed the hub without the rim built around it, and the rim I chose was more-or-less an Alex twin of the Sun Rhyno this was built with. If you want my quick take away, at the very least look to the updated'N360' (2nd generation) version of this hub. So without further ado...+++++++++++++++++++++++++++++++++++++++++++++++++++++++++I want to start by putting my 3-star 'It's OK' rating in context";3.0
Oscar Wilde's The Soul of Man under Socialism depicts the tangential and unintended callousness of socialistic thinking when it is merely theoretical and future-based and is not also activist, revolutionary and focused on the present.Wilde understands perfectly well that one of the principal goals of socialism is the elimination of poverty;3.0
My children and I love the little Critter books. This is a great book, but it was not bound well. The book fell out of the cover within a few days of recieving it. ;2.0
Before I begin, let me just say that I absolutely love her Dark series. Those books are great. This one had potential, but it just fell flat. Her characters simply weren't developed enough this time for me to relate to them. This effort was decent but not at all up to her usual standards. ;2.0
I would have enjoyed it more if the hero had some other powers other then being able to read minds, which by the way he's not very good at it.Or he should have been able to read the minds of who was betraying him and trying to kill him & his new bride. When the plot seems to be in trouble with no way out he can read thoughts. And only when the heroine is distressed,or in trouble. Who only questions him about his ability after she's married to him. And she keeps getting into trouble because he won't tell her anything, just keeps patting her on the head and telling her not to worry, he will protect her. Which he also doesn't do to well. The plot is long and at times boring. I hope Ms. Feehan stays with her paranormal charactars. ;3.0
